,title,Production company,Release date,Running time,Country,Language,Box office,Budget(float),Box office(float),Release date (datetime),imdb,metascore,rotten_tmatoes,plot,genre,user_ratings,Running time(int),Directed by,Produced by,Written by,Based on,Starring,Music by,Distributed by,Budget,Story by,Narrated by,Cinematography,Edited by,Screenplay by,Production companies,Japanese,Hepburn,Adaptation by,Traditional,Simplified
108,The World's Greatest Athlete,Walt Disney Productions,"February 1, 1973",93 min.,United States,English,"$22,583,370",,22583370.0,February 01 1973,5.8,N/A,34%,A down on his luck coach travels to Africa where he spots the world's greatest athlete - a white Tarzan-type. The coach brings him back to the U.S. of A. to compete.,"Comedy, Family, Romance, Sport","1,413",93.0,Robert Scheerer,Bill Walsh,"['Dee Caruso', 'Gerald Gardner']",,"['John Amos', 'Roscoe Lee Browne', 'Tim Conway', 'Dayle Haddon', 'Jan-Michael Vincent']",Marvin Hamlisch,Buena Vista Distribution,,,,Frank V. Phillips,,,,,,,,
109,Charley and the Angel,Walt Disney Productions,"['March 23, 1973']",93 minutes,United States,English,,,,March 23 1973,6.1,N/A,33%,"Charley is a workaholic family man that finds out from an angel that his ""number's up"" and he will be dying soon so he tries to change his ways and be a better husband and father with the time he has left.","Family, Comedy, Fantasy",438,93.0,Vincent McEveety,Bill Anderson,"['Will Stanton', '(book author)', 'Roswell Rogers (film writer)']",,"['Fred MacMurray', 'Cloris Leachman', 'Harry Morgan', 'Kathleen Cody', 'Kurt Russell']","['Paul J. Smith', 'Buddy Baker']",Buena Vista Distribution,,,,Charles F. Wheeler,"['Bob Bring', 'Ray de Leuw']",,,,,,,
110,One Little Indian,Walt Disney Productions,"['June 20, 1973']",90 Minutes,United States,English,$2 million,,2000000.0,June 20 1973,6.3,N/A,39%,"On the run from the Cavalry, a man tries to disappear while accompanied by two camels and a runaway boy. His escape is made harder when he meets a widow and her daughter who may turn him in.","Comedy, Family, Western",504,90.0,Bernard McEveety,Winston Hibler,Harry Spalding,,"['James Garner', 'Vera Miles', 'Pat Hingle', 'Morgan Woodward', 'Jodie Foster']",Jerry Goldsmith,Buena Vista Distribution,,,,Charles F. Wheeler,Robert Stafford,,,,,,,
111,Robin Hood,Walt Disney Productions,"['November 8, 1973']",83 minutes,United States,English,$32 million,5000000.0,32000000.0,November 08 1973,6.6,53,43%,"In twelfth-century England, Robin Longstride and his band of marauders confront corruption in a local village and lead an uprising against the crown that will forever alter the balance of world power.","Action, Adventure, Drama, History","250,452",83.0,Wolfgang Reitherman,Wolfgang Reitherman,,The legend of Robin Hood,"['Peter Ustinov', 'Phil Harris', 'Brian Bedford', 'Terry-Thomas', 'Roger Miller', 'Pat Buttram', 'George Lindsey', 'Andy Devine']",George Bruns,Buena Vista Distribution,$5 million,"['Larry Clemmons', 'Ken Anderson', 'Vance Gerry', 'Frank Thomas', 'Eric Cleworth', 'Julius Svendsen', 'David Michener']",,,"['Tom Acosta', 'Jim Melton']",,,,,,,
112,Superdad,Walt Disney Productions,"['December 14, 1973']",96 minutes,United States,English,$7 million (US/Canada rentals),,7000000.0,December 14 1973,5.2,N/A,33%,"Charlie McCready is a worried father. His daughter, Wendy will be attending college in the fall, and he feels the crowd she's hanging out with has no ambition, especially her boyfriend, ...","Comedy, Family",596,96.0,Vincent McEveety,Bill Anderson,"['Joseph L. McEveety', 'Harlan Ware']",,"['Bob Crane', 'Barbara Rush', 'Kurt Russell', 'Joe Flynn', 'Kathleen Cody']",Buddy Baker,Buena Vista Distribution,,,,Andrew Jackson,Ray de Leuw,,,,,,,
113,Herbie Rides Again,Walt Disney Productions,"['June 6, 1974']",88 minutes,United States,English,"['$38,229,000 (US/Canada gross)', '$30.8 million (worldwide rentals)']",,38229000.0,June 06 1974,5.7,49,80%,The living Volkswagen Beetle helps an old lady protect her home from a corrupt developer.,"Comedy, Family, Fantasy, Romance","7,256",88.0,Robert Stevenson,Bill Walsh,,"['Characters', 'by Gordon Buford']","['Helen Hayes', 'Ken Berry', 'Stefanie Powers', 'Keenan Wynn', 'John McIntire']",George Bruns,Buena Vista Distribution,,Gordon Buford,,Frank V. Phillips,Cotton Warburton,Bill Walsh,,,,,,
114,The Bears and I,Walt Disney Productions,"['July 31, 1974']",89 minutes,United States,English,$4 million (rentals) (US/Canada),,4000000.0,July 31 1974,6.2,N/A,29%,A man seeking peace and quiet finds himself father to three bears.,"Drama, Family",297,89.0,Bernard McEveety,Winston Hibler,,"['The Bears and I', 'by Robert Franklin Leslie']","['Patrick Wayne', 'Chief Dan George', 'Andrew Duggan', 'Michael Ansara', 'Robert Pine']",Buddy Baker,Buena Vista Distribution,,,Jack Speirs,Ted D. Landon,G. Gregg McLaughlin,John Whedon,,,,,,
115,The Castaway Cowboy,Walt Disney Productions,"['August 1, 1974']",91 minutes,United States,English,,,,August 01 1974,5.9,N/A,32%,"A Texas cowboy is rescued at sea by a 12-year-old boy. While he waits to return home, he decides to help out his rescuer's family.","Comedy, Family, Western",421,91.0,Vincent McEveety,"['Ron Miller', 'Winston Hibler']",Don Tait,,"['James Garner', 'Vera Miles', 'Eric Shea', 'Robert Culp']",Robert F. Brunner,Buena Vista Distribution,,,,Andrew Jackson,Cotton Warburton,,,,,,,
116,The Island at the Top of the World,Walt Disney Productions,"December 20, 1974 (with Winnie the Pooh and Tigger Too )",93 mins,United States,"['English', 'Swedish', 'Norwegian', 'Danish', 'Icelandic']",$10 million (US/Canada rentals),8000000.0,10000000.0,December 20 1974,6.3,N/A,43%,"In 1907, four explorers discover a lost colony of Vikings in the Arctic.","Adventure, Family, Fantasy, Sci-Fi","2,275",93.0,Robert Stevenson,Winston Hibler,"['Ian Cameron', '(novel)', 'John Whedon', '(screenplay)']",,"['Donald Sinden', 'David Hartman', 'Jacques Marin', 'Mako', 'Agneta Eckemyr']",Maurice Jarre,Buena Vista Distribution,$8 million,,,Frank V. Phillips,Robert Stafford,,,,,,,
117,The Strongest Man in the World,Walt Disney Productions,"['February 6, 1975']",92 minutes,United States,English,$6.6 million (US/Canada rentals),,6600000.0,February 06 1975,6.1,63,39%,Dexter Riley and his friends accidently discover a new chemical mixed with a cereal seems to give anyone temporary superhuman strength,"Comedy, Family, Sci-Fi","2,669",92.0,Vincent McEveety,Bill Anderson,Joseph L. McEveety,,"['Kurt Russell', 'Joe Flynn', 'Eve Arden', 'Cesar Romero', 'Phil Silvers']",Robert F. Brunner,Buena Vista Distribution,,,,Andrew Jackson,Cotton Warburton,,,,,,,
118,Escape to Witch Mountain,Walt Disney Productions,"['March 21, 1975 (U.S.)']",97 min.,United States,English,"$20,000,000",,20000000.0,March 21 1975,6.4,60,76%,Two mysterious orphan children have extraordinary powers and are chased by a scheming millionaire. But where do these kids really call home?,"Adventure, Family, Fantasy, Mystery, Sci-Fi","9,085",97.0,John Hough,"['Ron Miller', 'Jerome Courtland']",,"['Escape to Witch Mountain', 'by', 'Alexander H. Key']","['Eddie Albert', 'Ray Milland', 'Donald Pleasence', 'Kim Richards', 'Ike Eisenmann']",Johnny Mandel,Buena Vista Distribution,,,,"Frank V. Phillips , ASC",Robert Stafford,Robert Malcolm Young,,,,,,
119,The Apple Dumpling Gang,Walt Disney Productions,"['July 24, 1975']",100 minutes,United States,English,"$36,853,000",,36853000.0,July 24 1975,6.5,59,56%,Three orphan children strike gold in 1878 California.,"Comedy, Family, Western","4,980",100.0,Norman Tokar,Bill Anderson,Don Tait,,"['Bill Bixby', 'Susan Clark', 'Don Knotts', 'Tim Conway', 'David Wayne', 'Slim Pickens', 'Harry Morgan', 'John McGiver', ""Clay O'Brien"", 'Don Knight']","['Paul J. Smith', 'Buddy Baker', 'Joseph S. Dubin', '(orchestration)']",Buena Vista Distribution,,,,Frank V. Phillips,Ray de Leuw,,,,,,,
120,One of Our Dinosaurs is Missing,Walt Disney Productions,"['July 9, 1975']",100 minutes,"['United Kingdom', 'United States']",English,$5.5 million (North American rentals),,5500000.0,July 09 1975,6.0,N/A,68%,"A suspected Western spy steals a secret microfilm from China and hides it in the skeleton of a museum dinosaur, prompting a frantic search for it by various interested parties.","Family, Adventure, Comedy, Mystery, Thriller","1,577",100.0,Robert Stevenson,Bill Walsh,Bill Walsh,The Great Dinosaur Robbery by,"['Peter Ustinov', 'Helen Hayes', 'Clive Revill', 'Derek Nimmo']",Ron Goodwin,Buena Vista Distribution,,,,Paul Beeson,Peter Boita,,,,,,,
121,The Best of Walt Disney's True-Life Adventures,Walt Disney Productions,"['October 8, 1975']",89 minutes,United States,English,,,,October 08 1975,7.1,N/A,,Animals of all kinds are filmed in different moments of habitat.,"Documentary, Family",116,89.0,James Algar,"['Ben Sharpsteen', 'James Algar']","['James Algar', 'Winston Hibler', 'Ted Sears']",,,"['Paul Smith', 'Oliver Wallace', 'Buddy Baker']",Buena Vista Distribution,,,Winston Hibler,"['Alfred G. Milotte', 'Elma Milotte', 'N. Paul Kenworthy', 'Robert H. Crandall', 'Hugh A. Wilmar', 'James R. Simon', 'Herb and Lois Crisler', 'Tom McHugh', 'Jack C. Couffer']","['Norman Palmer', 'Lloyd L. Richardson', 'Anthony Gerard', 'Gregg McLaughlin', 'Gordon Brenner']",,,,,,,
122,Ride a Wild Pony,Walt Disney Productions,"December 25, 1975",91 minutes,"['United States', 'Australia']",English,,1000000.0,,December 25 1975,6.3,N/A,56%,"Scott, a poor farm boy, is given a wild pony from a wealthy ranch owner's herd to ride to and from school. Scott and his pony soon become an inseparable team, until one day the pony ...","Adventure, Family",155,91.0,Don Chaffey,Jerome Courtland,Rosemary Anne Sisson,"['A Sporting Proposition', '(novel)', 'by', 'James Aldridge']","['Robert Bettles', 'Eva Griffith', 'Michael Craig']",John Addison,"['Buena Vista Distribution', '(US)', 'British Empire Films', '(Australia)']",AU$1 million,,,Jack Cardiff,Mike Campbell,,,,,,,
123,"No Deposit, No Return",Walt Disney Productions,"['February 11, 1976 (Los Angeles)']",112 minutes,United States,English,,,,February 11 1976,6.5,N/A,68%,"After finding out that their mother is going to be working through another school holiday, two children are shipped to spend the holiday with their Grandfather. On their way to their ...","Comedy, Family","1,225",112.0,Norman Tokar,Ron Miller,"['Arthur Alsberg', 'Don Nelson']",,"['David Niven', 'Darren McGavin', 'Don Knotts', 'Herschel Bernardi', 'Charles Martin Smith', 'Barbara Feldon', 'Kim Richards', 'Brad Savage']",Buddy Baker,Buena Vista Distribution,,,,Frank V. Phillips,Cotton Warburton,,,,,,,
124,Treasure of Matecumbe,Walt Disney Productions,"['July 1, 1976']",115 minutes,United States,English,,,,July 01 1976,6.2,N/A,44%,"In 1869 Kentucky, a young boy and his friends set out to find a treasure chest hidden by his late father in the Florida Everglades during the Civil War.","Adventure, Family, Western",512,115.0,Vincent McEveety,"['Bill Anderson', 'Ron Miller']",Don Tait,"['A Journey to Matecumbe', 'by', 'Robert Lewis Taylor']","['Johnny Doran', 'Billy Atmore', 'Robert Foxworth', 'Joan Hackett', 'Peter Ustinov', 'Vic Morrow']",Buddy Baker,Buena Vista Distribution,,,,Frank V. Phillips,Cotton Warburton,,,,,,,
125,Gus,Walt Disney Productions,"['July 7, 1976']",95 minutes,United States,English,"$21,873,000",,21873000.0,July 07 1976,5.9,52,59%,"The California Atoms are in last place with no hope of moving up. But by switching the mule from team mascot to team member, (He can kick 100 yard field goals!) they start winning, and move...","Comedy, Family, Sport","1,614",95.0,Vincent McEveety,Ron Miller,,,"['Don Knotts', 'Edward Asner', 'Gary Grimes', 'Tim Conway', 'Harold Gould', 'Ronnie Schell', 'Tom Bosley', 'Louise Williams', 'Dick Butkus']",Robert F. Brunner,Buena Vista Distribution,,Ted Key,,Frank Phillips,Robert Stafford,"['Arthur Alsberg', 'Don Nelson']",,,,,,
126,The Shaggy D.A.,Walt Disney Productions,"['December 17, 1976']",91 min.,United States,English,$10.5 million (US and Canada rentals),,10500000.0,December 17 1976,5.9,60,50%,A lawyer makes an interesting discovery that could affect his chances of getting elected to office.,"Comedy, Family, Fantasy","2,548",91.0,Robert Stevenson,Bill Anderson,Don Tait,The Hound of Florence by Felix Salten,"['Dean Jones', 'Suzanne Pleshette', 'Tim Conway', 'Keenan Wynn']","['Paul J. Smith', 'Buddy Baker']",Buena Vista Distribution,,,,Frank V. Phillips,"['Bob Bring', 'Norman R. Palmer']",,,,,,,
127,Freaky Friday,Walt Disney Productions,"['December 17, 1976']",95 minutes,United States,English,$36 million,5000000.0,36000000.0,December 17 1976,6.2,70,88%,"An overworked mother and her daughter do not get along. When they switch bodies, each is forced to adapt to the other's life for one freaky Friday.","Comedy, Family, Fantasy, Music, Romance","123,211",95.0,Gary Nelson,Ron Miller,,"['Freaky Friday', 'by Mary Rodgers']","['Jodie Foster', 'Barbara Harris', 'John Astin']",Johnny Mandel,Buena Vista Distribution,$5 million,,,Charles F. Wheeler,Cotton Warburton,Mary Rodgers,,,,,,
128,Escape from the Dark,Walt Disney Productions,"['May 26, 1976', '(UK)', 'March 11, 1977', '(US)']",104 minutes,"['United Kingdom', 'United States']",English,,,,May 26 1976,,,,,,,104.0,Charles Jarrott,Ron Miller,Rosemary Anne Sisson,,"['Alastair Sim', 'Peter Barkworth', 'Maurice Colbourne', 'Susan Tebbs', 'Andrew Harrison', 'Chloe Franks']",Ron Goodwin,Buena Vista Distribution,,"['Burt Kennedy', 'Rosemary Anne Sisson']",,Paul Beeson,Richard Marden,,,,,,,
129,The Many Adventures of,Walt Disney Productions,"['March 11, 1977']",74 minutes,United States,English,,,,March 11 1977,7.6,N/A,100%,"In this collection of animated shorts based on the stories and characters by A.A. Milne, Winnie the Pooh, a honey-loving teddy bear, embarks on some eccentric adventures.","Animation, Adventure, Comedy, Family, Musical","31,962",74.0,"['John Lounsbery', 'Wolfgang Reitherman']",Wolfgang Reitherman,,"['Winnie-the-Pooh', 'by', 'A. A. Milne']","['Sterling Holloway', 'John Fiedler', 'Junius Matthews', 'Paul Winchell', 'Howard Morris', 'Bruce Reitherman', 'Jon Walmsley', 'Timothy Turner']","['Richard M. Sherman', 'Robert B. Sherman', '(songs)', 'Buddy Baker', '(score)']",Buena Vista Distribution,,"['Larry Clemmons', 'Ralph Wright', 'Vance Gerry', 'Xavier Atencio', 'Ken Anderson', 'Julius Svendsen', 'Ted Berman', 'Eric Cleworth']",Sebastian Cabot,,"['Tom Acosta', 'James Melton']",,,,,,,
130,A Tale of Two Critters,Walt Disney Productions,"['June 22, 1977']",48 minutes,United States,English,,,,June 22 1977,7.1,N/A,,"A bear cub and a raccoon become fast friends when they're swept away down a river, away from their families.","Adventure, Family",59,48.0,Jack Speirs,Jack Speirs,,,,Buddy Baker,Buena Vista Distribution,,,Mayf Nutter,,G. Gregg McLaughlin,Jack Speirs,,,,,,
131,The Rescuers,Walt Disney Productions,"['June 22, 1977']",77 minutes,United States,English,$169 million,7500000.0,169000000.0,June 22 1977,6.9,74,81%,Two mice of the Rescue Aid Society search for a little girl kidnapped by unscrupulous treasure hunters.,"Animation, Adventure, Comedy, Family, Fantasy","56,999",77.0,"['Wolfgang Reitherman', 'John Lounsbery', 'Art Stevens']","['Wolfgang Reitherman', 'Ron W. Miller']",,"['The Rescuers', 'and', 'Miss Bianca', 'by', 'Margery Sharp']","['Bob Newhart', 'Eva Gabor', 'Michelle Stacy', 'Geraldine Page', 'Joe Flynn', 'Jim Jordan', 'John McIntire', 'Jeanette Nolan', 'Pat Buttram', 'Bernard Fox']",Artie Butler,Buena Vista Distribution,$7.5 million,"['Larry Clemmons', 'Vance Gerry', 'Ken Anderson', 'Frank Thomas', 'Burny Mattinson', 'Fred Lucky', 'Dick Sebast', 'David Michener', 'Ted Berman']",,,"['Jim Koford', 'James Melton']",,,,,,,
132,Herbie Goes to Monte Carlo,Walt Disney Productions,"['June 24, 1977']",104 minutes,United States,English,$29 million,,29000000.0,June 24 1977,5.7,38,60%,"Herbie, the Volkswagen Beetle with a mind of its own, is racing in the Monte Carlo Rally. Unbeknownst to Herbie's driver, thieves have hidden a cache of stolen diamonds in Herbie's gas tank, and are now trying to get them back.","Action, Adventure, Comedy, Crime, Family, Romance, Sport","6,687",104.0,Vincent McEveety,Ron Miller,"['Arthur Alsberg', 'Don Nelson']","['Characters', 'by Gordon Buford']","['Dean Jones', 'Don Knotts', 'Julie Sommars', 'Jacques Marin', 'Roy Kinnear', 'Bernard Fox', 'Eric Braeden', 'Xavier Saint-Macary', 'Johnny Haymer']",Frank De Vol,Buena Vista Distribution,,,,Leonard J. South,Cotton Warburton,,,,,,,
133,Pete's Dragon,Walt Disney Productions,"['November 3, 1977']",128 minutes,United States,English,$36 –39.6 million,10000000.0,36.0,November 03 1977,6.7,71,88%,"The adventures of an orphaned boy named Pete and his best friend Elliott, who happens to be a dragon.","Action, Adventure, Comedy, Drama, Family, Fantasy","53,074",128.0,Don Chaffey,"['Jerome Courtland', 'Ron W. Miller']",,,"['Helen Reddy', 'Jim Dale', 'Mickey Rooney', 'Red Buttons', 'Jeff Conaway', 'Shelley Winters', 'Jane Kean', 'Jim Backus', 'Sean Marshall', 'Charlie Callas']",Irwin Kostal,Buena Vista Distribution,$10 million,"['Seton I. Miller', 'S.S. Field']",,Frank Phillips,Gordon D. Brenner,Malcolm Marmorstein,,,,,,
134,Candleshoe,Walt Disney Productions,"December 16, 1977",101 minutes,United States,English,,,,December 16 1977,6.8,68,71%,"Welcome to Candleshoe, a stately English manor where a swashbuckling pirate hid a fortune in Spanish doubloons centuries ago. And that's what young orphan Casey and a sly con man are determined to find.","Adventure, Comedy, Drama, Family","3,676",101.0,Norman Tokar,Ron Miller,"['David Swift', 'Rosemary Anne Sisson']",Christmas at Candleshoe novel by Michael Innes,"['Jodie Foster', 'David Niven', 'Helen Hayes', 'Leo McKern']",Ron Goodwin,Buena Vista Distribution,,,,Paul Beeson,Peter Boita,,,,,,,
135,Return from Witch Mountain,Walt Disney Productions,"['March 10, 1978']",94 minutes,United States,English,,,,March 10 1978,5.8,51,50%,"Tia and Tony visit Los Angeles, but he's quickly kidnapped by an evil scientist, leaving her to desperately search for him.","Family, Adventure, Sci-Fi, Fantasy","4,403",94.0,John Hough,"['Ron Miller', 'Jerome Courtland']",Malcolm Marmorstein,Characters created by Alexander Key,"['Bette Davis', 'Christopher Lee', 'Kim Richards', 'Ike Eisenmann', 'Jack Soo', 'Anthony James']",Lalo Schifrin,Buena Vista Distribution,,,,Frank V. Phillips,Bob Bring,,,,,,,
136,The Cat from Outer Space,Walt Disney Productions,"['June 30, 1978 (New York)']",104 minutes,United States,English,,3500000.0,,June 30 1978,6.1,58,67%,"Three scientists help an Alien feline, stranded on Earth, to repair its damaged spacecraft in order to return home but their efforts are hampered by inept army officials and foreign spies.","Comedy, Family, Sci-Fi","4,397",104.0,Norman Tokar,Ron Miller,Ted Key,,"['Ken Berry', 'Sandy Duncan', 'Harry Morgan', 'Ronnie Schell', 'Roddy McDowall', 'McLean Stevenson']",Lalo Schifrin,Buena Vista Distribution,$3.5 to 4 million,,,Charles F. Wheeler,Cotton Warburton,,,,,,,
137,Hot Lead and Cold Feet,Walt Disney Productions,"July 5, 1978",90 minutes,United States,English,,,,July 05 1978,6.2,N/A,65%,This saga of the old west involves twin brothers who compete for possession of a rickety cow town founded by their father while a crooked Mayor tries to put an end to the competitors so he can inherit the town himself.,"Action, Comedy, Family, Western","1,150",90.0,Robert Butler,Ron Miller,"['Joe McEveety', 'Arthur Alsberg', 'Don Nelson']",,"['Jim Dale', 'Karen Valentine', 'Don Knotts', 'Jack Elam', 'Darren McGavin']",Buddy Baker,Buena Vista Distribution,,Rod Piffath,,Frank V. Phillips,Ray de Leuw,,,,,,,
138,The North Avenue Irregulars,Walt Disney Productions,"February 9, 1979",100 minutes,United States,English,,,,February 09 1979,6.8,N/A,78%,"When crooks set up operations in a traditional town, a minister and a group of church ladies are willing to do anything, no matter how wacky, to get them out.","Action, Comedy, Crime, Family","1,038",100.0,Bruce Bilson,Ron Miller,Don Tait,,"['Edward Herrmann', 'Barbara Harris', 'Susan Clark', 'Karen Valentine', 'Michael Constantine', 'Cloris Leachman', 'Steve Franken', 'Patsy Kelly', 'Douglas Fowley', 'Virginia Capers', 'Melora Hardin', 'Alan Hale, Jr.', 'Ruth Buzzi']","['Richard Bowden', 'Robert F. Brunner']",Buena Vista Distribution,,,,Leonard J. South,Gordon D. Brenner,,,,,,,
139,The Apple Dumpling Gang Rides Again,Walt Disney Productions,"['June 27, 1979']",88 minutes,United States,English,"$20,931,111",,20931111.0,June 27 1979,6.2,37,54%,"The adventures of two idiotic outlaw wannabees, Amos and Theodore.","Comedy, Family, Western","2,402",88.0,Vincent McEveety,"['Tom Leetch', 'Ron W. Miller']",Don Tait,,"['Tim Conway', 'Don Knotts', 'Tim Matheson', 'Kenneth Mars', 'Jack Elam']","['Paul J. Smith', 'Buddy Baker', 'Joseph S. Dubin', '(orchestration)']",Buena Vista Distribution,,,,Frank V. Phillips,Gordon Brenner,,,,,,,
140,Unidentified Flying Oddball,Walt Disney Productions,"['July 19, 1979 (London)', 'August 3, 1979 (Los Angeles)']",93 minutes,"['United Kingdom', 'United States']",English,,5250000.0,,July 19 1979,5.3,66,33%,An astronaut and his android double travel back to the time of King Arthur.,"Comedy, Family, Adventure, Fantasy, Sci-Fi",917,93.0,Russ Mayberry,Ron Miller,Don Tait,A Connecticut Yankee in King Arthur's Court novel by Mark Twain,"['Dennis Dugan', 'Jim Dale', 'Ron Moody', 'Kenneth More', 'John Le Mesurier']",Ron Goodwin,Buena Vista Distribution,$5.25 million,,,Paul Beeson,Peter Boita,,,,,,,
141,The Black Hole,Walt Disney Productions,"['December 18, 1979 (United Kingdom)', 'December 21, 1979 (United States)']",98 minutes,United States,English,['$35.8 million'],20000000.0,35800000.0,December 18 1979,6.0,52,38%,"A research vessel finds a missing ship, commanded by a mysterious scientist, on the edge of a black hole.","Action, Sci-Fi","23,014",98.0,Gary Nelson,Ron Miller,,,"['Maximilian Schell', 'Anthony Perkins', 'Robert Forster', 'Joseph Bottoms', 'Yvette Mimieux', 'Ernest Borgnine', 'Roddy McDowall', 'Slim Pickens', 'Tom McLoughlin']",John Barry,Buena Vista Distribution,$20 million,"['Jeb Rosebrook', 'Bob Barbash', 'Richard Landau']",,Frank Phillips,Gregg McLaughlin,"['Gerry Day', 'Jeb Rosebrook']",,,,,,
142,The Omega Connection,Walt Disney Productions,"December 21, 1979",100 minutes,United States,English,,,,December 21 1979,,,,,,,100.0,Robert Clouse,Jan Williams,"['Gail Morgan Hickman', 'David E. Boston']",,"['Jeffrey Byron', 'Larry Cedar']",John Cameron,Buena Vista Distribution,,,,Godfrey A. Godar,"['Peter Boita', 'Mike Campbell']",,,,,,,
143,Midnight Madness,Walt Disney Productions,"['February 8, 1980']",112 minutes,United States,English,$2.9 million,,2900000.0,February 08 1980,6.5,28,70%,"Leon planned ""the great all-nighter"" by picking college students to participate in an all-night long scavenger hunt. The 5 teams are given clues to solve, leading them to the next clue, ...",Comedy,"3,114",112.0,"['Michael Nankin', 'David Wechter']",Ron Miller,"['Michael Nankin', 'David Wechter']",,"['David Naughton', 'Michael J. Fox', 'Stephen Furst', 'Maggie Roswell', 'Eddie Deezen', 'Dirk Blocker', 'Debra Clinger', 'Brad Wilkin']",Julius Wechter,Buena Vista Distribution,,,,Frank V. Phillips,"['Norman R. Palmer', 'Jack Sekely']",,,,,,,
144,The Watcher in the Woods,Walt Disney Productions,"['April 17, 1980 (New York City)', 'October 9, 1981 (U.S.)']",84 minutes,United States,English,$5 million,9000000.0,5000000.0,April 17 1980,6.3,N/A,50%,"When a family moves to a country home, the young girls experience strange happenings that have a link to an occult event years past.","Family, Horror, Mystery, Thriller","5,308",84.0,"['John Hough', 'Vincent McEveety (uncredited)']",Ron Miller,,"['A Watcher in the Woods', 'by', 'Florence Engel Randall']","['Bette Davis', 'Carroll Baker', 'David McCallum', 'Lynn-Holly Johnson', 'Kyle Richards']",Stanley Myers,Buena Vista Distribution,$9 million,,,Alan Hume,Geoffrey Foot,"['Brian Clemens', 'Harry Spalding', 'Rosemary Anne Sisson']",,,,,,
145,Herbie Goes Bananas,Walt Disney Productions,"['June 27, 1980']",98 minutes,United States,English,$18 million,,18000000.0,June 27 1980,5.0,55,40%,The adorable little VW helps its owners break up a counterfeiting ring in Mexico.,"Adventure, Comedy, Family, Fantasy","5,091",98.0,Vincent McEveety,"['Kevin Corcoran', 'Ron Miller', 'Don Tait']",Don Tait,"['Characters', 'by Gordon Buford']","['Cloris Leachman', 'Harvey Korman', 'Charles Martin Smith', 'Stephan W. Burns', 'John Vernon', 'Elyssa Davalos', 'Joaquin Garay III', 'Richard Jaeckel', 'Alex Rocco']",Frank De Vol,Buena Vista Distribution,,,,Frank V. Phillips,Gordon D. Brenner,,,,,,,
146,The Last Flight of Noah's Ark,Walt Disney Productions,"['July 9, 1980 (Los Angeles)']",97 minutes,United States,English,$11 million,6000000.0,11000000.0,July 09 1980,5.8,N/A,40%,"When a plane carrying various animals makes a forced landing on a desert island, the only chance to escape is to convert the plane into a boat.","Adventure, Family","1,221",97.0,Charles Jarrott,"['Ron Miller', 'Jan Williams']","['Steven W. Carabatsos', 'Sandy Glass', 'George Arthur Bloom']","['""The Gremlin\'s Castle""', 'by', 'Ernest K. Gann']","['Elliott Gould', 'Geneviève Bujold', 'Ricky Schroder']",Maurice Jarre,Buena Vista Distribution,$6-8 million,,,Charles F. Wheeler,Gordon D. Brenner,,,,,,,
