,title,Production company,Release date,Running time,Country,Language,Box office,Budget(float),Box office(float),Release date (datetime),imdb,metascore,rotten_tmatoes,plot,genre,user_ratings,Running time(int),Directed by,Produced by,Written by,Based on,Starring,Music by,Distributed by,Budget,Story by,Narrated by,Cinematography,Edited by,Screenplay by,Production companies,Japanese,Hepburn,Adaptation by,Traditional,Simplified
214,D3: The Mighty Ducks,"['Walt Disney Pictures', 'Avnet-Kerner Productions']","['October 4, 1996']",104 minutes,United States,English,$22.9 million,,22900000.0,October 04 1996,5.5,N/A,20%,"The unruly team of hockey misfits grows up a bit and receives scholarships to a prestigious prep school, where they take on the snotty varsity team.","Action, Comedy, Drama, Family, Sport","24,007",104.0,Robert Lieberman,"['Jordan Kerner', 'Jon Avnet']",,"['Characters', 'by Steven Brill']","['Emilio Estevez', 'Jeffrey Nordling', 'Heidi Kling', 'Joss Ackland']",J. A. C. Redford,Buena Vista Pictures,,"['Kenneth Johnson', 'Jim Burnstein']",,David Hennings,Patrick Lussier,"['Steven Brill', 'Jim Burnstein']",,,,,,
215,101 Dalmatians,"['Walt Disney Pictures', 'Great Oaks Entertainment']","['November 27, 1996']",103 minutes,United States,English,$320.7 million,75000000.0,320700000.0,November 27 1996,5.7,49,41%,"An evil high-fashion designer plots to steal Dalmatian puppies in order to make an extravagant fur coat, but instead creates an extravagant mess.","Adventure, Comedy, Crime, Family","99,712",103.0,Stephen Herek,"['John Hughes', 'Ricardo Mestres']",,"['The Hundred and One Dalmatians', 'by', 'Dodie Smith']","['Glenn Close', 'Jeff Daniels', 'Joely Richardson', 'Joan Plowright']",Michael Kamen,Buena Vista Pictures Distribution,$75 million,,,Adrian Biddle,Trudy Ship,John Hughes,,,,,,
216,That Darn Cat,"['Walt Disney Pictures', 'Robert Simonds Productions']","['February 14, 1997']",86 minutes,United States,English,$18.3 million,,18300000.0,February 14 1997,4.7,36,13%,"A maid is kidnapped and scratches a message onto D.C. the cat's collar and when his owner Patti discovers this, she plays amateur detective with the help of D.C. to try to find the culprits.","Action, Comedy, Crime, Family, Mystery","4,016",86.0,Bob Spiers,Robert Simonds,,"['Undercover Cat', 'by Gordon Gordon', 'Mildred Gordon']","['Christina Ricci', 'Doug E. Doug', 'George Dzundza', 'Peter Boyle', 'Michael McKean', 'Bess Armstrong']",Richard Kendall Gibbs,Buena Vista Pictures,,"['Gordon Gordon', 'Mildred Gordon', 'Bill Walsh']",,Jerzy Zielinski,Roger Barton,"['Scott Alexander', 'Larry Karaszewski']",,,,,,
217,Jungle 2 Jungle,"['Walt Disney Pictures', 'TF1 International']","['March 7, 1997 (US)', 'August 5, 1998 (France)']",105 minutes,"['United States', 'France']",English,$59.9 million,32000000.0,59900000.0,March 07 1997,5.2,42,19%,"A man learns he has a thirteen-year-old son who was raised in the jungle and brings the boy to New York City, turning his life upside down in the process.","Comedy, Family","22,469",105.0,John Pasquin,"['Richard Baker', 'Brad Krevoy']","['Bruce A. Evans', 'Raynold Gideon']",,"['Tim Allen', 'Martin Short', 'Lolita Davidovich', 'David Ogden Stiers', 'JoBeth Williams']",Michael Convertino,"['Buena Vista Pictures', '(United States)', 'Ariane Films', '(France)']",$32 million,,,Tony Pierce-Roberts,Michael A. Stevenson,,,,,,,
218,Hercules,,"['June 13, 1997 (limited release)', 'June 27, 1997 (wide release)']",93 minutes,United States,English,$252.7 million,85000000.0,252700000.0,June 13 1997,7.3,74,84%,The son of Zeus and Hera is stripped of his immortality as an infant and must become a true hero in order to reclaim it.,"Animation, Adventure, Comedy, Family, Fantasy, Musical, Romance","201,500",93.0,"['Ron Clements', 'John Musker']","['Alice Dewey', 'Ron Clements', 'John Musker']",,Heracles,"['Tate Donovan', 'Danny DeVito', 'James Woods', 'Susan Egan', 'Rip Torn']",Alan Menken,Buena Vista Pictures Distribution,$85 million,"['Kaan Kalyon', 'Kelly Wightman', 'Randy Cartwright', 'John Ramirez', 'Jeff Snow', 'Vance Gerry', 'Kirk Hanson', 'Francis Glebas', 'Mark Kennedy', 'Bruce M. Morris', 'Don Dougherty', 'Thom Enriquez']",,,Tom Finan,"['Ron Clements', 'John Musker', 'Donald McEnery', 'Bob Shaw', 'Irene Mecchi']","['Walt Disney Pictures', 'Walt Disney Feature Animation']",,,,,
219,George of the Jungle,"['Walt Disney Pictures', 'Mandeville Films', 'Jay Ward Productions', 'The Kerner Entertainment Company']","['July 16, 1997']",92 minutes,United States,English,$174.4 million,55000000.0,174400000.0,July 16 1997,5.5,53,56%,A man raised in the jungle by apes falls in love with a wealthy American heiress.,"Action, Adventure, Comedy, Family, Romance","70,513",92.0,Sam Weisman,"['David Hoberman', 'Jordan Kerner', 'Jon Avnet']",,"['George of the Jungle', 'by', 'Jay Ward']","['Brendan Fraser', 'Leslie Mann', 'Thomas Haden Church', 'Holland Taylor', 'Richard Roundtree', 'John Cleese']",Marc Shaiman,Buena Vista Pictures Distribution,$55 million,Dana Olsen,,Thomas E. Ackerman,"['Kent Beyda', 'Roger Bondelli', 'Stuart Pappé']","['Dana Olsen', 'Audrey Wells']",,,,,,
220,Air Bud,"Buddy Films, Inc.","August 1, 1997",98 minutes,"['United States', 'Canada']",English,$27.8 million,3000000.0,27800000.0,August 01 1997,5.2,N/A,45%,An unexpected player joins the school basketball team - a circus dog who escaped from a cruel master.,"Comedy, Drama, Family, Sport","16,268",98.0,Charles Martin Smith,"['Robert Vince', 'William Vince']","['Paul Tamasy', 'Aaron Mendelsohn']","['Air Buddy', 'by', 'Kevin DiCicco']","['Michael Jeter', 'Kevin Zegers', 'Wendy Makkena', 'Eric Christmas', 'Bill Cobbs', 'Buddy']",Brahm Wenger,"['Buena Vista Pictures Distribution', '(United States)', 'Malofilm', '(Canada)']",$3 million,,,Mike Southon,Alison Grace,,,,,,,
221,RocketMan,"['Walt Disney Pictures', 'Caravan Pictures', 'Roger Birnbaum Productions']","['October 10, 1997']",95 minutes,United States,English,$15.4 million,16000000.0,15400000.0,October 10 1997,7.3,69,,A musical fantasy about the fantastical human story of Elton John's breakthrough years.,"Biography, Drama, Music, Musical","125,960",95.0,Stuart Gillard,Roger Birnbaum,"['Oren Aviv', 'Craig Mazin', 'Greg Erb']",,"['Harland Williams', 'Jessica Lundy', 'William Sadler', 'Jeffrey DeMunn', 'Beau Bridges']",Michael Tavera,Buena Vista Pictures,$16 million,,,Steven Poster,William D. Gordean,,,,,,,
222,Flubber,"['Walt Disney Pictures', 'Great Oaks']","['November 16, 1997 ( Pennsylvania )', 'November 26, 1997 (United States)']",93 minutes,United States,English,$178 million,80000000.0,178000000.0,November 16 1997,5.3,37,24%,"An absent-minded professor discovers ""flubber,"" a rubber-like super-bouncy substance.","Comedy, Family, Sci-Fi","83,146",93.0,Les Mayfield,"['John Hughes', 'Ricardo Mestres']",,"['""A Situation of Gravity"" by Samuel W. Taylor', 'The Absent-Minded Professor (1961) by Bill Walsh']","['Robin Williams', 'Marcia Gay Harden', 'Christopher McDonald', 'Raymond J. Barry', 'Clancy Brown', 'Ted Levine']",Danny Elfman,Buena Vista Pictures,$80 million,,,Dean Cundey,"['Harvey Rosenstock', 'Michael A. Stevenson']",['John Hughes'],,,,,,
223,Mr. Magoo,"['Walt Disney Pictures', 'UPA Productions']","['December 25, 1997']",87 minutes,United States,English,$28.9 million,30000000.0,28900000.0,December 25 1997,4.0,18,7%,The myopic millionaire defeats jewel smugglers in his usual bumbling manner.,"Adventure, Comedy, Family","14,143",87.0,Stanley Tong,Ben Myron,"['Pat Proft', 'Tom Sherohman']","['Mr. Magoo', 'by', 'Millard Kaufman', 'John Hubley']","['Leslie Nielsen', 'Kelly Lynch', 'Ernie Hudson', 'Stephen Tobolowsky', 'Nick Chinlund', 'Malcolm McDowell']",Mike Tavera,Buena Vista Pictures,$30 million,,,Jingle Ma,"['Michael R. Miller', 'Stuart Pappé', 'David Rawlins']",,,,,,,
224,Meet the Deedles,"['Walt Disney Pictures', 'DIC Entertainment', 'Peak Productions']","['March 27, 1998 (United States)']",93 minutes,United States,English,$4.4 million,24000000.0,4400000.0,March 27 1998,4.1,N/A,7%,Two surfers end up as Yellowstone park rangers and have to stop a former ranger who is out for revenge.,"Comedy, Family","2,668",93.0,Steve Boyum,"['Dale Pollock', 'Aaron Meyerson']",Jim Herzfeld,,"['Paul Walker', 'Steve Van Wormer', 'John Ashton', 'A. J. Langer', 'Robert Englund', 'Dennis Hopper']",Steve Bartek,Buena Vista Pictures,$24 million,,,David Hennings,Alan Cody,,,,,,,
225,Mulan,"['Walt Disney Pictures', 'Walt Disney Feature Animation']","['June 19, 1998']",87 minutes,United States,English,$304.3 million,90000000.0,304300000.0,June 19 1998,7.6,71,86%,"To save her father from death in the army, a young maiden secretly goes in his place and becomes one of China's greatest heroines in the process.","Animation, Adventure, Family, Fantasy, Musical, War","250,279",87.0,"['Barry Cook', 'Tony Bancroft']",Pam Coats,,Ballad of Mulan by Guo Maoqian,"['Ming-Na Wen', 'Eddie Murphy', 'BD Wong', 'Miguel Ferrer', 'June Foray', 'James Hong', 'Pat Morita', 'George Takei']",Jerry Goldsmith,Buena Vista Pictures,$90 million,Robert D. San Souci,,,Michael Kelly,"['Rita Hsiao', 'Philip LaZebnik', 'Chris Sanders', 'Eugenia Bostwick-Singer', 'Raymond Singer']",,,,,,
226,The Parent Trap,Walt Disney Pictures,"['July 29, 1998 (United States)']",128 minutes,United States,English,$92.1 million,15000000.0,92100000.0,July 29 1998,6.5,64,86%,"Identical twins Annie and Hallie, separated at birth and each raised by one of their biological parents, later discover each other for the first time at summer camp and make a plan to bring their wayward parents back together.","Adventure, Comedy, Drama, Family, Romance","118,273",128.0,Nancy Meyers,Charles Shyer,,"['Lottie and Lisa', 'by', 'Erich Kästner']","['Lindsay Lohan', 'Dennis Quaid', 'Natasha Richardson']",Alan Silvestri,Buena Vista Pictures Distribution,$15 million,,,Dean Cundey,Stephen A. Rotter,"['David Swift', 'Nancy Meyers', 'Charles Shyer']",,,,,,
227,I'll Be Home for Christmas,"['Walt Disney Pictures', 'Mandeville Films']","['November 13, 1998']",86 minutes,United States,English,$12.2 million,30000000.0,12200000.0,November 13 1998,5.5,N/A,23%,"A college student faces an impossible journey when he is left stranded in the desert, thousands of miles from home, with no money and only a few days left until Christmas.","Comedy, Family","8,936",86.0,Arlene Sanford,"['Robin French', 'Justis Greene', 'David Hoberman', 'Tracey Trench']",,,"['Jonathan Taylor Thomas', 'Jessica Biel', 'Adam LaVorgna', ""Sean O'Bryan"", 'Gary Cole']",John Debney,Buena Vista Pictures,$30 million,Michael Allin,,Hiro Narita,Anita Brandt-Burgoyne,"['Tom Nursall', 'Harris Goldberg']",,,,,,
228,A Bug's Life,"['Walt Disney Pictures', 'Pixar Animation Studios']","['November 20, 1998']",95 minutes,United States,English,$363.3 million,120000000.0,363300000.0,November 20 1998,7.2,77,92%,"A misfit ant, looking for ""warriors"" to save his colony from greedy grasshoppers, recruits a group of bugs that turn out to be an inept circus troupe.","Animation, Adventure, Comedy, Family","262,739",95.0,John Lasseter,"['Darla K. Anderson', 'Kevin Reher']",,,"['Dave Foley', 'Kevin Spacey', 'Julia Louis-Dreyfus']",Randy Newman,Buena Vista Pictures Distribution,$120 million,"['John Lasseter', 'Andrew Stanton', 'Joe Ranft']",,Sharon Calahan,Lee Unkrich,"['Andrew Stanton', 'Donald McEnery', 'Bob Shaw']",,,,,,
229,Mighty Joe Young,"['Walt Disney Pictures', 'RKO Pictures', 'The Jacobson Company']","['December 25, 1998']",114 minutes,United States,English,$50.6 million (US),90000000.0,50600000.0,December 25 1998,5.6,51,54%,"A legendary fifteen-foot tall mountain gorilla named Joe is taken to an animal sanctuary in California by zoologist Gregg O'Hara (Bill Paxton) and Jill Young (Charlize Theron), with whom he grew up. Poacher Strasser (Rade Serbedzija) returns from the past to seek vengeance on Joe.","Action, Adventure, Family, Fantasy, Thriller","27,272",114.0,Ron Underwood,"['Ted Hartley', 'Tom Jacobson']",,"['Mighty Joe Young', 'by', 'Merian C. Cooper', 'Ruth Rose']","['Bill Paxton', 'Charlize Theron', 'Rade Šerbedžija', 'Naveen Andrews', 'Regina King', 'David Paymer']",James Horner,Buena Vista Pictures,$90 million,,,"['Donald Peterman', 'Oliver Wood']",Paul Hirsch,"['Mark Rosenthal', 'Lawrence Konner']",,,,,,
230,My Favorite Martian,Walt Disney Pictures,"['February 12, 1999']",93 minutes,United States,English,$36.8 million,65000000.0,36800000.0,February 12 1999,5.1,33,12%,A Martian lands on Earth and makes friends with a reporter.,"Comedy, Family, Sci-Fi","12,660",93.0,Donald Petrie,"['Jerry Leider', 'Robert Shapiro', 'Marc Toberoff']","['Sherri Stoner', 'Deanna Oliver']",My Favorite Martian created by John L. Greene,"['Jeff Daniels', 'Christopher Lloyd', 'Elizabeth Hurley', 'Daryl Hannah', 'Wallace Shawn', 'Christine Ebersole', 'Ray Walston']",John Debney,Buena Vista Pictures,$65 million,,,Thomas E. Ackerman,Malcolm Campbell,,,,,,,
231,Doug's 1st Movie,"['Walt Disney Pictures', 'Jumbo Pictures', 'Walt Disney Television Animation', 'Plus One Animation']","['March 26, 1999']",83 minutes,United States,English,$19.4 million,5000000.0,19400000.0,March 26 1999,5.0,N/A,26%,Doug and his pal Skeeter set out to find the monster of Lucky Duck Lake.,"Animation, Adventure, Comedy, Drama, Family, Fantasy, Sci-Fi","2,928",83.0,Maurice Joyce,"['David Campbell', 'Melanie Grisanti', 'Jim Jinkins', 'Bruce Knapp', 'Jack Spillum']",,"['Doug', 'by Jim Jinkins']","['Tom McHugh', 'Fred Newman', 'Chris Phillips', 'Constance Shulman', 'Frank Welker', 'Doug Preis', 'Guy Hadley', 'Alice Playten', 'Doris Belack']",Mark Watters,Buena Vista Pictures,$5 million,,,,"['Alysha Cohen', 'Christopher Gee']",Ken Scarborough,,,,,,
232,Endurance,Walt Disney Pictures,"['February 5, 1999']",83 minutes,"['United States', 'United Kingdom', 'Germany']",English,,,,February 05 1999,7.4,N/A,100%,"The story of the 1914-1916 Antarctic exploration mission of Sir Ernest Shackleton. The ship sails south, breaking the ice, and ultimately getting trapped by the fast-changing weather. The ...","Documentary, Adventure, History",450,83.0,"['Leslie Woodhead', 'Bud Greenspan']","['Terrence Malick', 'Max Palevsky', 'Edward R. Pressman']",,,"['Haile Gebrselassie', 'Shawananness Gebrselassie', 'Yonas Zergaw', 'Tedesse Haile', 'Bekele Gebrselassie', 'Alem Tellahun']","['John Powell', 'Hans Zimmer']",Buena Vista Pictures,,,,Ivan Strasburg,"['Saar Klein', 'Oral Norrie Ottey']",,,,,,,
233,Tarzan,,"['June 12, 1999 ( El Capitan Theatre )', 'June 16, 1999 (United States )']",88 minutes,United States,English,$448.2 million,130000000.0,448200000.0,June 12 1999,7.3,79,89%,A man raised by gorillas must decide where he really belongs when he discovers he is a human.,"Animation, Adventure, Family, Romance","198,679",88.0,"['Kevin Lima', 'Chris Buck']",Bonnie Arnold,,"['Tarzan of the Apes', 'by', 'Edgar Rice Burroughs']","['Tony Goldwyn', 'Minnie Driver', 'Glenn Close', 'Alex D. Linz', ""Rosie O'Donnell"", 'Brian Blessed', 'Nigel Hawthorne', 'Lance Henriksen', 'Wayne Knight', 'Taylor Dempsey']",Mark Mancina,Buena Vista Pictures,$130 million,"['Stephen Anderson', 'Mark D. Kennedy', 'Carole Holliday', 'Gaëtan Brizzi', 'Paul Brizzi', 'Don Dougherty', 'Ed Gombert', 'Randy Haycock', 'Don Hall', 'Kevin L. Harkey', 'Glen Keane', 'Burny Mattinson', 'Frank Nissen', 'John Norton', 'Jeff Snow', 'Michael Surrey', 'Christopher J. Ure', 'Mark Walton', 'Stevie Wermers', 'Kelly Wightman', 'John Ramirez']",,,Gregory Perler,"['Tab Murphy', 'Bob Tzudiker', 'Noni White']","['Walt Disney Pictures', 'Walt Disney Feature Animation']",,,,,
234,Inspector Gadget,,"['July 23, 1999']",78 minutes,United States,English,$134.4 million,90000000.0,134400000.0,July 23 1999,4.1,36,21%,A security guard's dreams come true when he is selected to be transformed into a cybernetic police officer.,"Action, Adventure, Comedy, Crime, Family, Sci-Fi","44,648",78.0,David Kellogg,"['Roger Birnbaum', 'Andy Heyward', 'Jordan Kerner', 'Aaron Meyerson']",,"['Inspector Gadget', 'by', 'Andy Heyward', 'Jean Chalopin', 'Bruno Bianchi']","['Matthew Broderick', 'Rupert Everett', 'Joely Fisher', 'Michelle Trachtenberg', 'Mike Hagerty', 'Andy Dick', 'Cheri Oteri', 'Dabney Coleman']",John Debney,Buena Vista Pictures Distribution,$90 million,"['Kerry Ehrin', 'Dana Olsen']",,Adam Greenberg,"['Alan Cody', 'Thom Noble']","['Kerry Ehrin', 'Zak Penn']","['Walt Disney Pictures', 'Caravan Pictures', 'DIC Entertainment', 'Avnet/Kerner Productions', 'Roger Birnbaum Productions']",,,,,
235,The Straight Story,"['Asymmetrical Productions', 'Canal+', 'FilmFour Productions', 'Ciby 2000', 'Le Studio Canal+']","['May 1999 ( Cannes )', 'October 15, 1999 (United States)']",112 minutes,"['United States', 'United Kingdom', 'France']",English,$6.2 million,10000000.0,6200000.0,,8.0,86,95%,An old man makes a long journey by lawnmower to mend his relationship with an ill brother.,"Biography, Drama","80,004",112.0,David Lynch,"['Mary Sweeney', 'Neal Edelstein', 'Alain Sarde']","['John Roach', 'Mary Sweeney']",,"['Richard Farnsworth', 'Sissy Spacek', 'Harry Dean Stanton']",Angelo Badalamenti,"['Buena Vista Pictures', '(United States)', 'FilmFour Distribution (United Kingdom)', 'Bac Films', '(France)']",$10 million,,,Freddie Francis,Mary Sweeney,,,,,,,
236,Toy Story 2,"['Walt Disney Pictures', 'Pixar Animation Studios']","['November 13, 1999 ( El Capitan Theatre )', 'November 24, 1999 (United States)']",92 minutes,United States,English,$497.4 million,90000000.0,497400000.0,November 13 1999,7.9,88,100%,"When Woody is stolen by a toy collector, Buzz and his friends set out on a rescue mission to save Woody before he becomes a museum toy property with his roundup gang Jessie, Prospector, and Bullseye.","Animation, Adventure, Comedy, Family, Fantasy","517,501",92.0,John Lasseter,"['Helene Plotkin', 'Karen Robert Jackson']",,,"['Tom Hanks', 'Tim Allen']",Randy Newman,Buena Vista Pictures Distribution,$90 million,"['John Lasseter', 'Pete Docter', 'Ash Brannon', 'Andrew Stanton']",,Sharon Calahan,"['Edie Bleiman', 'David Ian Salter', 'Lee Unkrich']","['Andrew Stanton', 'Rita Hsiao', 'Doug Chamberlin', 'Chris Webb']",,,,,,
237,Fantasia 2000,"['Walt Disney Pictures', 'Walt Disney Feature Animation']","['December 17, 1999 ( Carnegie Hall )', 'January 1, 2000 ( IMAX )', 'June 16, 2000 (United States)']",74 minutes,United States,English,$90.9 million,85000000.0,90900000.0,December 17 1999,7.2,59,81%,An update of the original film with new interpretations of great works of classical music.,"Animation, Comedy, Family, Fantasy, Music","34,499",74.0,"['Don Hahn', 'Pixote Hunt', 'Hendel Butoy', 'Eric Goldberg', 'James Algar', 'Francis Glebas', 'Paul and Gaëtan Brizzi']","['Roy E. Disney', 'Donald W. Ernst']",See credits,,"['James Levine', 'Steve Martin', 'Itzhak Perlman', 'Quincy Jones', 'Bette Midler', 'James Earl Jones', 'Penn & Teller', 'Angela Lansbury']",See program,Buena Vista Pictures,$80–$85 million,,,Tim Suhrstedt,"['Jessica Ambinder-Rojas', 'Lois Freeman-Fox']",,,,,,,
238,The Tigger Movie,"['Walt Disney Television Animation', 'Walt Disney Animation Japan', 'Walt Disney Pictures']","['February 11, 2000 (United States)']",77 minutes,United States,English,$96.2 million,15000000.0,96200000.0,February 11 2000,6.3,53,62%,Tigger goes looking through the hundred-acre-wood to find his family.,"Animation, Comedy, Drama, Family, Musical","16,904",77.0,Jun Falkenstein,Cheryl Abood,,"['Characters created', 'by', 'A. A. Milne']","['Jim Cummings', 'Nikita Hopkins', 'Ken Sansom', 'John Fiedler', 'Peter Cullen', 'Andre Stojka', 'Kath Soucie', 'Tom Attenborough', 'John Hurt']",Harry Gregson-Williams,Buena Vista Pictures,$15 million –$30 million,Eddie Guzelian,,,"['Makoto Arai', 'Robert Fisher, Jr.']",Jun Falkenstein,,,,,,
239,Dinosaur,"['Walt Disney Pictures', 'Walt Disney Feature Animation', 'The Secret Lab']","['May 19, 2000 (United States)']",82 minutes,United States,English,$349.8 million,127500000.0,349800000.0,May 19 2000,6.5,56,64%,An orphaned dinosaur raised by lemurs joins an arduous trek to a sanctuary after a meteorite shower destroys his family home.,"Animation, Adventure, Family, Thriller","52,270",82.0,"['Ralph Zondag', 'Eric Leighton']",Pam Marsden,,,"['D. B. Sweeney', 'Alfre Woodard', 'Ossie Davis', 'Max Casella', 'Hayden Panettiere', 'Samuel E. Wright', 'Julianna Margulies', 'Peter Siragusa', 'Joan Plowright', 'Della Reese']",James Newton Howard,Buena Vista Pictures,$127.5 million,"['John Harrison', 'Robert Nelson Jacobs', 'Thom Enriquez', 'Ralph Zondag']",,"['David Hardberger', 'S. Douglas Smith']",H. Lee Peterson,"['John Harrison', 'Robert Nelson Jacobs']",,,,,,
240,The Kid,Walt Disney Pictures,"['July 7, 2000']",104 minutes,United States,English,$110.3 million,65000000.0,110300000.0,July 07 2000,8.3,N/A,100%,"The Tramp cares for an abandoned child, but events put that relationship in jeopardy.","Comedy, Drama, Family","109,985",104.0,Jon Turteltaub,"['Hunt Lowry', 'Arnold Rifkin', 'Christina Steinberg', 'Jon Turteltaub', 'David Willis']",Audrey Wells,,"['Bruce Willis', 'Spencer Breslin', 'Emily Mortimer', 'Lily Tomlin', 'Chi McBride']","['Marc Shaiman', 'Jason White']",Buena Vista Pictures,$65 million,,,Peter Menzies Jr.,"['Peter Honess', 'David Rennie']",,,,,,,
241,Remember The Titans,"['Walt Disney Pictures', 'Jerry Bruckheimer Films', 'Technical Black Films']","['September 29, 2000']",113 minutes,United States,English,$136.7 million,30000000.0,136700000.0,September 29 2000,7.8,48,73%,The true story of a newly appointed African-American coach and his high school team on their first season as a racially integrated unit.,"Biography, Drama, Sport","195,100",113.0,Boaz Yakin,"['Jerry Bruckheimer', 'Chad Oman']",Gregory Allen Howard,,"['Denzel Washington', 'Will Patton', 'Donald Faison', 'Nicole Ari Parker']",Trevor Rabin,Buena Vista Pictures,$30 million,,,Philippe Rousselot,Michael Tronick,,,,,,,
242,102 Dalmatians,"['Walt Disney Pictures', 'Cruella Productions', 'Kanzaman S.A.M. Films']","['November 22, 2000']",100 minutes,United States,English,$183.6 million,85000000.0,183600000.0,November 22 2000,4.9,35,31%,Cruella DeVil gets out of prison and goes after the puppies once more.,"Adventure, Comedy, Family","34,143",100.0,Kevin Lima,Edward S. Feldman,,,Glenn Close,David Newman,Buena Vista Pictures,$85 million,"['Kristen Buckley', 'Brian Regan']",,Adrian Biddle,Gregory Perler,"['Kristen Buckley', 'Brian Regan', 'Bob Tzudiker', 'Noni White']",,,,,,
243,The Emperor's New Groove,"['Walt Disney Pictures', 'Walt Disney Feature Animation']","['December 15, 2000']",78 minutes,United States,English,$169.3 million,100000000.0,169300000.0,December 15 2000,7.3,70,85%,"Emperor Kuzco is turned into a llama by his ex-administrator Yzma, and must now regain his throne with the help of Pacha, the gentle llama herder.","Animation, Adventure, Comedy, Family, Fantasy","176,336",78.0,Mark Dindal,Randy Fullmer,,"['Kingdom of the Sun', 'by', 'Roger Allers', 'Matthew Jacobs']","['David Spade', 'John Goodman', 'Eartha Kitt', 'Patrick Warburton', 'Wendie Malick']",John Debney,Buena Vista Pictures,$100 million,"['Chris Williams', 'Mark Dindal']",,,Pamela Ziegenhagen-Shefland,David Reynolds,,,,,,
244,Recess: School's Out,"['Walt Disney Pictures', 'Walt Disney Television Animation', 'Walt Disney Television Animation Digital Production', 'Paul & Joe Productions', 'Sunwoo Animation Sunwoo Digital International']","['February 10, 2001 (premiere)', 'February 16, 2001 (United States)']",83 minutes,United States,English,$44.5 million,23000000.0,44500000.0,February 10 2001,6.6,43,60%,TJ and company must save summer vacation from disappearing forever.,"Animation, Comedy, Family","9,313",83.0,Chuck Sheetz,"['Joe Ansolabehere', 'Paul Germain', 'Stephen Swofford']",,"['Recess', 'by Paul Germain', 'Joe Ansolabehere']","['Andrew Lawrence', ""Rickey D'Shon Collins"", 'Jason Davis', 'Ashley Johnson', 'Courtland Mead', 'Pamela Segall', 'Dabney Coleman', 'Melissa Joan Hart', 'April Winchell', 'James Woods']",Denis M. Hannigan,Buena Vista Pictures,$23 million,"['Paul Germain', 'Joe Ansolabehere', 'Jonathan Greenberg']",,,Tony Mizgalski,Jonathan Greenberg,,,,,,
245,Atlantis: The Lost Empire,"['Walt Disney Pictures', 'Walt Disney Feature Animation']","['June 3, 2001 (Premiere)', 'June 15, 2001 (United States)']",96 minutes,United States,English,$186.1 million,90000000.0,186100000.0,June 03 2001,6.9,52,49%,A young adventurer named Milo Thatch joins an intrepid group of explorers to find the mysterious lost continent of Atlantis.,"Animation, Action, Adventure, Family, Fantasy, Sci-Fi","101,676",96.0,"['Gary Trousdale', 'Kirk Wise']",Don Hahn,,,"['Michael J. Fox', 'James Garner', 'Cree Summer', 'Don Novello', 'Phil Morris', 'Claudia Christian', 'Jacqueline Obradors', 'Florence Stanley', 'David Ogden Stiers', 'John Mahoney', 'Jim Varney', 'Corey Burton', 'Leonard Nimoy']",James Newton Howard,Buena Vista Pictures,$90–120 million,"['Kirk Wise', 'Gary Trousdale', 'Joss Whedon', 'Bryce Zabel', 'Jackie Zabel', 'Tab Murphy']",,,Ellen Keneshea,Tab Murphy,,,,,,
246,The Princess Diaries,"['Walt Disney Pictures', 'BrownHouse Productions']","['August 3, 2001']",115 minutes,United States,English,$165.3 million,26000000.0,165300000.0,August 03 2001,6.3,52,48%,"Mia Thermopolis has just found out that she is the heir apparent to the throne of Genovia. With her friends Lilly and Michael Moscovitz in tow, she tries to navigate through the rest of her sixteenth year.","Comedy, Family, Romance","125,728",115.0,Garry Marshall,"['Whitney Houston', 'Debra Martin Chase', 'Mario Iscovich']",,"['The Princess Diaries', 'by', 'Meg Cabot']","['Anne Hathaway', 'Héctor Elizondo', 'Heather Matarazzo', 'Mandy Moore', 'Caroline Goodall', 'Robert Schwartzman', 'Julie Andrews']",John Debney,Buena Vista Pictures,$26 million,,,Karl Walter Lindenlaub,Bruce Green,Gina Wendkos,,,,,,
