,title,Production company,Release date,Running time,Country,Language,Box office,Budget(float),Box office(float),Release date (datetime),imdb,metascore,rotten_tmatoes,plot,genre,user_ratings,Running time(int),Directed by,Produced by,Written by,Based on,Starring,Music by,Distributed by,Budget,Story by,Narrated by,Cinematography,Edited by,Screenplay by,Production companies,Japanese,Hepburn,Adaptation by,Traditional,Simplified
313,Beverly Hills Chihuahua,"['Walt Disney Pictures', 'Mandeville Films']","['October 3, 2008 (United States)']",91 minutes,United States,English,$149.3 million,20000000.0,149300000.0,October 03 2008,3.8,41,40%,"While on vacation in Mexico, Chloe, a ritzy Beverly Hills chihuahua, finds herself lost and in need of assistance in order to get back home.","Adventure, Comedy, Drama, Family, Romance","22,457",91.0,Raja Gosnell,"['David Hoberman', 'Todd Lieberman', 'John Jacobs', 'Ricardo Del Río']",,,"['Piper Perabo', 'Manolo Cardona', 'Jamie Lee Curtis', 'Andy García', 'George Lopez', 'Drew Barrymore']",Heitor Pereira,"['Walt Disney Studios', 'Motion Pictures']",$20 million,Jeff Bushell,,Phil Meheux,Sabrina Plisco,"['Analisa LaBianco', 'Jeff Bushell']",,,,,,
314,Morning Light,Walt Disney Pictures,"October 17, 2008",100 minutes,United States,English,"$275,776",,275776.0,October 17 2008,5.8,51,33%,"Fifteen young sailors... six months of intense training... one chance at the brass ring. This documentary tells the story of a group of intrepid and determined young men and women, on the ...","Documentary, Sport",333,100.0,Mark Monroe,"['Roy E. Disney', 'Leslie DeMeuse', 'Morgan Sackett']",,,,,"['Walt Disney Studios', 'Motion Pictures']",,,,,Paul Crowder,,,,,,,
315,High School Musical 3: Senior Year,"['Walt Disney Pictures', 'Borden and Rosenbush Entertainment']","['October 17, 2008 (London)', 'October 24, 2008 (United States)']","['111 minutes (theatrical)', '120 minutes (extended/Disney+)']",United States,English,$252.9 million,11000000.0,252900000.0,October 17 2008,,,,,,,111.0,Kenny Ortega,"['Bill Borden', 'Barry Rosenbush']",Peter Barsocchini,,"['Zac Efron', 'Vanessa Hudgens', 'Ashley Tisdale', 'Lucas Grabeel', 'Corbin Bleu', 'Monique Coleman']",David Lawrence,Walt Disney Studios Motion Pictures,$11 million,,,Daniel Aranyò,Don Brochu,,,,,,,
316,Bolt,"['Walt Disney Pictures', 'Walt Disney Animation Studios']","['November 21, 2008']",96 minutes,United States,English,$310 million,150000000.0,310000000.0,November 21 2008,6.8,67,89%,The canine star of a fictional sci-fi/action show that believes his powers are real embarks on a cross country trek to save his co-star from a threat he believes is just as real.,"Animation, Adventure, Comedy, Drama, Family","186,256",96.0,"['Chris Williams', 'Byron Howard']",Clark Spencer,,,"['John Travolta', 'Miley Cyrus']",John Powell,"['Walt Disney Studios', 'Motion Pictures']",$150 million,,,,Tim Mertens,"['Dan Fogelman', 'Chris Williams']",,,,,,
317,Bedtime Stories,"['Walt Disney Pictures', 'Happy Madison Productions', 'Gunn Films', 'Offspring Entertainment', 'Conman & Izzy Productions']","['December 25, 2008']",99 minutes,United States,English,$212.9 million,80000000.0,212900000.0,December 25 2008,6.0,33,27%,A hotel handyman's life changes when the lavish bedtime stories he tells his niece and nephew start to magically come true.,"Comedy, Family, Fantasy, Romance","86,854",99.0,Adam Shankman,"['Adam Sandler', 'Andrew Gunn', 'Jack Giarraputo']",,,"['Adam Sandler', 'Keri Russell', 'Guy Pearce', 'Russell Brand', 'Richard Griffiths', 'Jonathan Pryce', 'Courteney Cox', 'Lucy Lawless', 'Teresa Palmer']",Rupert Gregson-Williams,"['Walt Disney Studios', 'Motion Pictures']",$80 million,Tim Herlihy,,Michael Barrett,Tom Costain,"['Matt Lopez', 'Tim Herlihy']",,,,,,
318,Jonas Brothers: The 3D Concert Experience,"['Walt Disney Pictures', 'Jonas Films']","['February 27, 2009']","['76 minutes', '85 minutes']",United States,English,$23.1 million,,23100000.0,February 27 2009,1.5,45,23%,"A 3-D concert film of the 2008 Jonas Brothers ""Burning Up"" concert tour, as well as documentary footage on the lives of the three brothers.","Documentary, Music","17,198",76.0,Bruce Hendricks,"['Kevin Jonas Sr.', 'Alan Sacks', 'Johnny Wright', 'Phil McIntyre']",,,"['Kevin Jonas', 'Joe Jonas', 'Nick Jonas', 'Demi Lovato', 'Taylor Swift']",Jonas Brothers,"['Walt Disney Studios', 'Motion Pictures']",,,,"['Mitchell Amundsen', 'Reed Smoot']",Michael Tronick,,,,,,,
319,Race to Witch Mountain,"['Walt Disney Pictures', 'Gunn Films']","['March 11, 2009 (Egypt)', 'March 13, 2009 (United States)']",98 minutes,United States,English,$106.4 million,50000000.0,106400000.0,March 11 2009,5.7,52,43%,A Las Vegas cabbie enlists the help of a UFO expert to protect two siblings with paranormal powers from the clutches of an organization that wants to use the kids for their nefarious plans.,"Action, Adventure, Family, Fantasy, Sci-Fi, Thriller","54,909",98.0,Andy Fickman,Andrew Gunn,,"['Escape to Witch Mountain', 'by', 'Alexander Key']","['Dwayne Johnson', 'AnnaSophia Robb', 'Carla Gugino', 'Ciarán Hinds', 'Alexander Ludwig', 'Tom Everett Scott', 'Chris Marquette']",Trevor Rabin,"['Walt Disney Studios', 'Motion Pictures']",$50 million,Matt Lopez,,Greg Gardiner,David Rennie,"['Matt Lopez', 'Mark Bomback']",,,,,,
320,Hannah Montana: The Movie,"['Walt Disney Pictures', ""It's a Laugh Productions"", 'Millar Gough Ink']","['April 10, 2009']",97 minutes,United States,English,$169.2  million,30000000.0,169.2,April 10 2009,4.5,47,43%,"As Hannah Montana's popularity begins to take over her life, Miley Stewart, on the urging from her father takes a trip to her hometown of Crowley Corners, Tennessee to get some perspective on what matters in life the most.","Comedy, Drama, Family, Music, Romance","39,147",97.0,Peter Chelsom,"['David Blocker', 'Billy Ray Cyrus', 'Alfred Gough', 'Miles Millar', 'Steven Peterman', 'Michael Poryes']",Dan Berendsen,"['Hannah Montana', 'by', 'Michael Poryes', 'Rich Correll', ""Barry O'Brien""]","['Miley Cyrus', 'Emily Osment', 'Jason Earles', 'Melora Hardin', 'Vanessa Williams', 'Billy Ray Cyrus']",John Debney,Walt Disney Studios Motion Pictures,$30 million,,,David Hennings,Virginia Katz,,,,,,,
321,Earth,"['BBC Worldwide', 'Greenlight Media', 'Discovery Channel', 'BBC Natural History Unit']","['October 10, 2007 (France)', 'November 16, 2007 (United Kingdom)', 'January 12, 2008 (Germany)', 'April 22, 2009 (United States)']","['99 minutes (UK)', '90 minutes (U.S.)']","['France', 'United Kingdom', 'Germany', 'United States']",English,$109 million,47000000.0,109000000.0,October 10 2007,8.0,72,86%,"Feature-length version of the documentary TV series Planet Earth (2006), following the migration paths of four animal families.",Documentary,"14,144",99.0,"['Alastair Fothergill', 'Mark Linfield']","['Alix Tidmarsh', 'Sophokles Tasioulius']","['Alastair Fothergill', 'Mark Linfield', 'Leslie Megahey']",,,"['George Fenton', 'Berliner Philharmoniker']","['Gaumount (France)', 'Lionsgate UK (United Kingdom)', 'Universum Film (Germany)', 'Walt Disney Studios Motion Pictures (United States)']",$47 million,,"['Patrick Stewart', 'James Earl Jones', 'Constantino Romero', 'Ulrich Tukur', 'Ken Watanabe']",,"['Martin Elsbury', 'Vartan Nazarian']",,,,,,,
322,Up,"['Walt Disney Pictures', 'Pixar Animation Studios']","['May 29, 2009']",96 minutes,United States,English,$735.1 million,175000000.0,735100000.0,May 29 2009,8.2,88,98%,"78-year-old Carl Fredricksen travels to Paradise Falls in his house equipped with balloons, inadvertently taking a young stowaway.","Animation, Adventure, Comedy, Family","913,931",96.0,Pete Docter,Jonas Rivera,,,"['Ed Asner', 'Christopher Plummer', 'Jordan Nagai']",Michael Giacchino,"['Walt Disney Studios', 'Motion Pictures']",$175 million,"['Bob Peterson', 'Pete Docter', 'Tom McCarthy']",,"['Patrick Lin', 'Jean-Claudie Kalache']",Kevin Nolting,"['Bob Peterson', 'Pete Docter']",,,,,,
323,Lilly the Witch: The Dragon and the Magic Book,,,,"['Germany', 'Austria', 'Italy', 'Spain', 'United Kingdom']",German,,,,,5.2,N/A,27%,Little Lilly is apprenticed to become the successor of Surulunda the Witch. Based on the internationally best-selling book series.,"Adventure, Comedy, Family, Fantasy",485,,Stefan Ruzowitzky,,,,,Ian Honeyman,,,,,,,,,,,,,
324,G-Force,,"['July 24, 2009']",90 minutes,United States,English,$292.8 million,150000000.0,292800000.0,July 24 2009,5.1,41,22%,A specially trained squad of guinea pigs is dispatched to stop a diabolical billionaire from taking over the world.,"Animation, Action, Adventure, Comedy, Family, Fantasy, Sci-Fi","42,005",90.0,Hoyt H. Yeatman Jr.,Jerry Bruckheimer,,,"['Sam Rockwell', 'Tracy Morgan', 'Penélope Cruz', 'Jon Favreau', 'Nicolas Cage', 'Steve Buscemi', 'Zach Galifianakis', 'Bill Nighy', 'Will Arnett']",Trevor Rabin,Walt Disney Studios Motion Pictures,$150 million,"['Hoyt H. Yeatman Jr.', 'David P.I. James']",,Bojan Bazelli,"['Jason Hellmann', 'Mark Goldblatt']","['Cormac Wibberley', 'Marianne Wibberley']","['Walt Disney Pictures', 'Jerry Bruckheimer Films']",,,,,
325,Ponyo,Studio Ghibli,"['July 19, 2008']",101 minutes,Japan,Japanese,US$ 203.2 million,,,July 19 2008,7.7,86,92%,"A five-year-old boy develops a relationship with Ponyo, a young goldfish princess who longs to become a human after falling in love with him.","Animation, Adventure, Comedy, Family, Fantasy","121,119",101.0,Hayao Miyazaki,Toshio Suzuki,Hayao Miyazaki,"['The Little Mermaid', 'by', 'Hans Christian Andersen']","['Tomoko Yamaguchi', 'Kazushige Nagashima', 'Yūki Amami', 'George Tokoro', 'Yuria Nara', 'Hiroki Doi', 'Rumi Hiiragi', 'Akiko Yano', 'Kazuko Yoshiyuki', 'Tomoko Naraoka']",Joe Hisaishi,Toho,"['¥', '3.4 billion', '(', 'US$', '34 million)']",,,Atsushi Okui,Takeshi Seyama,,,,Gake no Ue no Ponyo,,,
326,Walt & El Grupo,,['2008'],,United States,English,,,,,6.3,55,59%,The story of the 1941 Goodwill Tour to South America made by Walt Disney and his staff.,Documentary,307,,Theodore Thomas,,Theodore Thomas,,,,Walt Disney Studios Motion Pictures,,,,,,,"['Walt Disney Family Foundation Films', 'Theodore Thomas Productions']",,,,,
327,The Book of Masters,"['The Walt Disney Company CIS', '(Russia)', 'Trite (Russia)']",['2009'],101 minutes,Russia,Russian,$11.3 million,8000000.0,11300000.0,,,,,,,,101.0,Vadim Sokolovsky,"['Leonid Vereshchagin,', 'Marina Zhigalov-Ozkan']","['Vadim Sokolovsky,', 'Anna Starobinets']",Russian fairy tales,,Yuri Poteyenko,,$8 million ( ₽ 350 million),,,Archil Akhvlediani,,,,,,,,
328,A Christmas Carol,"['Walt Disney Pictures', 'ImageMovers Digital']","['November 3, 2009 ( London )', 'November 6, 2009 (United States)']",96 minutes,United States,English,$325 million,175000000.0,325000000.0,November 03 2009,6.8,55,52%,"An animated retelling of Charles Dickens' classic novel about a Victorian-era miser taken on a journey of self-redemption, courtesy of several mysterious Christmas apparitions.","Animation, Drama, Family, Fantasy","99,123",96.0,Robert Zemeckis,"['Steve Starkey', 'Robert Zemeckis', 'Jack Rapke']",Robert Zemeckis,"['A Christmas Carol', 'by', 'Charles Dickens']","['Jim Carrey', 'Gary Oldman', 'Colin Firth', 'Bob Hoskins', 'Robin Wright Penn', 'Cary Elwes', 'Fionnula Flanagan']",Alan Silvestri,Walt Disney Studios Motion Pictures,$175-200 million,,,Robert Presley,Jeremiah O'Driscoll,,,,,,,
329,Old Dogs,"['Walt Disney Pictures', 'Tapestry Films']","['November 25, 2009']",88 minutes,United States,English,$96.8 million,35000000.0,96800000.0,November 25 2009,5.4,19,5%,Two friends and business partners find their lives turned upside down when strange circumstances lead them to be the temporary guardians of seven year-old twins.,"Comedy, Family","35,976",88.0,Walt Becker,"['Andrew Panay', 'Robert L. Levy', 'Peter Abrams']","['David Diamond', 'David Weissman']",,"['John Travolta', 'Robin Williams', 'Kelly Preston', 'Seth Green', 'Ella Bleu Travolta', 'Lori Loughlin', 'Matt Dillon']",John Debney,"['Walt Disney Studios', 'Motion Pictures']",$35 million,,,Jeffrey L. Kimball,"['Tom Lewis', 'Ryan Folsey']",,,,,,,
330,The Princess and the Frog,"['Walt Disney Pictures', 'Walt Disney Animation Studios']","['November 25, 2009 (Los Angeles premiere)', 'December 11, 2009 (United States)']",97 minutes,United States,English,$269 million,105000000.0,269000000.0,November 25 2009,7.1,73,85%,"A waitress, desperate to fulfill her dreams as a restaurant owner, is set on a journey to turn a frog prince back into a human being, but she has to face the same problem after she kisses him.","Animation, Adventure, Comedy, Family, Fantasy, Musical, Romance","121,316",97.0,"['Ron Clements', 'John Musker']",Peter Del Vecho,,"['The Frog Prince by Brothers Grimm', 'The Frog Princess by E. D. Baker']","['Anika Noni Rose', 'Bruno Campos', 'Keith David', 'Michael-Leon Wooley', 'Jim Cummings', 'Jennifer Cody', 'Peter Bartlett', 'Jenifer Lewis', 'Oprah Winfrey', 'Terrence Howard', 'John Goodman']",Randy Newman,"['Walt Disney Studios', 'Motion Pictures']",$105 million,"['Ron Clements', 'John Musker', 'Greg Erb', 'Jason Oremland']",,,Jeff Draheim,"['Ron Clements', 'John Musker', 'Rob Edwards']",,,,,,
331,Alice in Wonderland,"['Walt Disney Pictures', 'Roth Films', 'The Zanuck Company', 'Team Todd']","['February 25, 2010 ( Odeon Leicester Square )', 'March 5, 2010 (United States)']",108 minutes,United States,English,$1.025 billion,200000000.0,1024999999.9999999,February 25 2010,6.4,53,51%,"Nineteen-year-old Alice returns to the magical world from her childhood adventure, where she reunites with her old friends and learns of her true destiny: to end the Red Queen's reign of terror.","Adventure, Family, Fantasy","378,427",108.0,Tim Burton,"['Richard D. Zanuck', 'Joe Roth', 'Suzanne Todd', 'Jennifer Todd']",,"[""Alice's Adventures in Wonderland"", 'and', 'Through the Looking-Glass', 'by', 'Lewis Carroll']","['Johnny Depp', 'Anne Hathaway', 'Helena Bonham Carter', 'Crispin Glover', 'Matt Lucas', 'Mia Wasikowska', 'Alan Rickman', 'Stephen Fry', 'Michael Sheen', 'Timothy Spall']",Danny Elfman,Walt Disney Studios Motion Pictures,$150 –$200 million,,,Dariusz Wolski,Chris Lebenzon,Linda Woolverton,,,,,,
332,Waking Sleeping Beauty,Stone Circle Pictures,"['September 6, 2009 ( Telluride Film Festival )', 'March 26, 2010']",85 minutes,United States,English,"$84,918",,84918.0,September 06 2009,7.6,70,71%,"The story of the Disney Renaissance, an incredibly prolific, successful and prestigious decade lasting from 1984 to 1994 that saw the fallen Walt Disney Animation Studios' unexpected progressive triumphant return to excellence.",Documentary,"2,577",85.0,Don Hahn,"['Don Hahn', 'Peter Schneider']",Patrick Pacheco,,"['Roy E. Disney', 'Michael Eisner', 'Jeffrey Katzenberg', 'Randy Cartwright', 'Howard Ashman']",Chris P. Bacon,"['Walt Disney Studios', 'Motion Pictures']",,,Don Hahn,,"['Ellen Keneshea', 'Vartan Nazarian', 'John Damien Ryan']",,,,,,,
333,Oceans,"['Pathé', 'Participant Media', 'Galatée Films', 'Notro Films', 'France 2 Cinéma', 'France 3 Cinéma', 'Canal+', 'TPS Star', 'Alfred P. Sloan Foundation', 'Census of Marine Life']","['October 17, 2009 ( Tokyo International Film Festival )', 'January 24, 2010 (France)']","['104 minutes (Original cut)', '84 minutes (Disney cut)']",France,French,$82.7 million,80000000.0,82700000.0,October 17 2009,7.8,75,81%,"An ecological drama/documentary, filmed throughout the globe. Part thriller, part meditation on the vanishing wonders of the sub-aquatic world.","Documentary, Drama","8,994",104.0,"['Jacques Perrin', 'Jacques Cluzaud', '(co-director)']","['Jacques Perrin', 'Romain Legrand', 'Nicolas Mauvernay', 'Jake Eberts']","['Christophe Cheysson', 'Jacques Cluzaud', 'Laurent Debas', 'Stéphane Durand', 'Laurent Gaudé', 'Jacques Perrin', 'François Sarano']",,,Bruno Coulais,Pathé Distribution,$80 million,,"['Jacques Perrin', '(French)', 'Pierce Brosnan', '(English)']",David Reichert,"['Catherine Mauchain', 'Vincent Schmidt']",,,,,,,
334,Prince of Persia: The Sands of Time,,"['May 9, 2010 (London premiere)', 'May 28, 2010 (United States)']",116 minutes,United States,English,$336.4 million,150.0,336400000.0,May 09 2010,6.6,50,37%,A young fugitive prince and princess must stop a villain who unknowingly threatens to destroy the world with a special dagger that enables the magic sand inside to reverse time.,"Action, Adventure, Fantasy","268,772",116.0,Mike Newell,Jerry Bruckheimer,,"['Prince of Persia', 'by Jordan Mechner']","['Jake Gyllenhaal', 'Gemma Arterton', 'Ben Kingsley', 'Toby Kebbell', 'Alfred Molina']",Harry Gregson-Williams,"['Walt Disney Studios', 'Motion Pictures']",$150  million,Jordan Mechner,,John Seale,"['Michael Kahn', 'Martin Walsh', 'Mick Audsley']","['Boaz Yakin', 'Doug Miro', 'Carlo Bernard']","['Walt Disney Pictures', 'Jerry Bruckheimer Films']",,,,,
335,Toy Story 3,"['Walt Disney Pictures', 'Pixar Animation Studios']","['June 12, 2010 ( Taormina Film Fest )', 'June 18, 2010 (United States)']",103 minutes,United States,English,$1.067 billion,200000000.0,1067000000.0,June 12 2010,8.3,92,98%,"The toys are mistakenly delivered to a day-care center instead of the attic right before Andy leaves for college, and it's up to Woody to convince the other toys that they weren't abandoned and to return home.","Animation, Adventure, Comedy, Family, Fantasy","743,396",103.0,Lee Unkrich,Darla K. Anderson,,,"['Tom Hanks', 'Tim Allen', 'Joan Cusack', 'Don Rickles', 'Wallace Shawn', 'John Ratzenberger', 'Estelle Harris', 'Blake Clark', 'Jeff Pidgeon', 'Ned Beatty', 'Michael Keaton', 'Jodi Benson', 'John Morris']",Randy Newman,"['Walt Disney Studios', 'Motion Pictures']",$200 million,"['John Lasseter', 'Andrew Stanton', 'Lee Unkrich']",,"['Jeremy Lasky', 'Kim White']",Ken Schretzmann,Michael Arndt,,,,,,
336,The Sorcerer's Apprentice,"['Walt Disney Pictures', 'Jerry Bruckheimer Films', 'Saturn Films', 'Broken Road Productions']","['July 8, 2010 (Fantasia Film Festival)', 'July 14, 2010']",109 minutes,United States,English,$215.3 million,150000000.0,215300000.0,July 08 2010,6.1,46,40%,Master sorcerer Balthazar Blake must find and train Merlin's descendant to defeat dark sorceress Morgana la Fée.,"Action, Adventure, Family, Fantasy","151,097",109.0,Jon Turteltaub,Jerry Bruckheimer,,"[""The Sorcerer's Apprentice"", 'by', 'Johann Wolfgang von Goethe']","['Nicolas Cage', 'Jay Baruchel', 'Alfred Molina', 'Teresa Palmer', 'Monica Bellucci']",Trevor Rabin,"['Walt Disney Studios', 'Motion Pictures']",$150 million,"['Matt Lopez', 'Lawrence Konner', 'Mark Rosenthal']",,Bojan Bazelli,William Goldenberg,"['Doug Miro', 'Carlo Bernard', 'Matt Lopez']",,,,,,
337,Tales from Earthsea,Studio Ghibli,"['July 29, 2006']",115 minutes,Japan,Japanese,$68.7 million,22000000.0,68700000.0,July 29 2006,6.4,47,,"In a mythical land, a man and a young boy investigate a series of unusual occurrences.","Animation, Adventure, Fantasy","34,373",115.0,Gorō Miyazaki,"['Toshio Suzuki', 'Tomohiko Ishii']",,"['Earthsea', 'by', 'Ursula K. Le Guin']","['Bunta Sugawara', 'Junichi Okada', 'Aoi Teshima', 'Yūko Tanaka']",Tamiya Terashima,Toho,$22 million,,,,Takeshi Seyama,"['Gorō Miyazaki', 'Keiko Niwa']",,,Gedo Senki,,,
338,The Crimson Wing: Mystery of the Flamingos,"['Disneynature', 'Natural Light Films', 'Kudos Pictures']","['26 October 2008 ( France )', '29 September 2009 ( United Kingdom )']",74 minutes,"['United Kingdom', 'United States']",English,,,,October 26 2008,7.3,N/A,75%,The mysterious lives of flamingos are captured on film with a birds-eye view of the animals living in Africa.,Documentary,"1,089",74.0,"['Matthew Aeberhard', 'Leander Ward']","['Matthew Aeberhard', 'Leander Ward', 'Paul Webster', '(executive producer)', 'Stephen Garrett (executive producer)']",Melanie Finn,,,The Cinematic Orchestra and Claseria,Walt Disney Studios Motion Pictures,,,"['Mariella Frostrup', '(', 'UK', '/', 'US', ')', 'Zabou Breitman', '(', 'France', ')']",,,,,,,,,
339,Secretariat,"['Walt Disney Pictures', 'Mayhem Pictures']","['September 30, 2010 ( Hollywood )', 'October 8, 2010 (United States)']",123 minutes,United States,English,$60.3 million,35000000.0,60300000.0,September 30 2010,7.2,61,63%,"Penny Chenery Tweedy and colleagues guide her long-shot but precocious stallion to set, in 1973, the unbeaten record for winning the Triple Crown.","Biography, Drama, Family, History, Sport","26,070",123.0,Randall Wallace,"['Mark Ciardi', 'Gordon Gray']","['Mike Rich', 'Sheldon Turner']",,"['Diane Lane', 'John Malkovich', 'Dylan Walsh', 'James Cromwell', 'Kevin Connolly', 'Scott Glenn']",Nick Glennie-Smith,"['Walt Disney Studios', 'Motion Pictures']",$35 million,,,Dean Semler,John Wright,,,,,,,
340,Do Dooni Chaar,"['Walt Disney Pictures', 'Disney World Cinema', 'Planman Motion Pictures', 'Walt Disney Pictures India']",['8 October 2010'],108 minutes,India,Hindi,,,,October 08 2010,7.6,N/A,78%,A middle class family in India tries to buy a new car.,"Comedy, Drama","4,478",108.0,Habib Faisal,Arindam Chaudhuri,,,"['Rishi Kapoor', 'Neetu Singh']","['Meet Bros Anjjan', 'Ankit Tiwari']",Walt Disney Studios Motion Pictures,,Habib Faisal,,Anshuman Mahaley,Aarti Bajaj,"['Habib Faisal', 'Rahil Qazi']",,,,,,
341,Tangled,"['Walt Disney Pictures', 'Walt Disney Animation Studios']","['November 14, 2010 ( El Capitan Theatre )', 'November 24, 2010 (United States)']",100 minutes,United States,English,$592.4 million,260000000.0,592400000.0,November 14 2010,7.7,71,89%,"The magically long-haired Rapunzel has spent her entire life in a tower, but now that a runaway thief has stumbled upon her, she is about to discover the world for the first time, and who she really is.","Animation, Adventure, Comedy, Family, Fantasy, Musical, Romance","398,224",100.0,"['Nathan Greno', 'Byron Howard']",Roy Conli,,"['Rapunzel', 'by the', 'Brothers Grimm']","['Mandy Moore', 'Zachary Levi', 'Donna Murphy']",Alan Menken,Walt Disney Studios Motion Pictures,$260 million,,,,Tim Mertens,Dan Fogelman,,,,,,
342,The Boys: The Sherman Brothers' Story,"['Walt Disney Pictures', 'Red Hour Films']","['April 24, 2009 (San Francisco International Film Festival)', 'May 22, 2009 (United States)']",101 minutes,United States,English,"$55,513",,55513.0,April 24 2009,7.8,78,90%,Their music is unforgettable. Their name is legend. Delve into the lives and cinematic legacy of the prolific songwriting duo whose music has been featured in classic movies such as Mary Poppins (1964) and The Jungle Book (1967).,Documentary,817,101.0,"['Gregory V. Sherman', 'Jeffrey C. Sherman']","['Gregory V. Sherman', 'Jeffrey C. Sherman', 'Executive:', 'Stuart Cornfeld', 'Ben Stiller']",,,"['Richard M. Sherman', 'Robert B. Sherman']","['Richard M. Sherman', 'Robert B. Sherman']","['Walt Disney Studios', 'Motion Pictures']",,,,Richard Numeroff,Rich Evirs,,,,,,,
343,Tron: Legacy,,"['November 30, 2010 (Tokyo)', 'December 17, 2010 (United States)']",125 minutes,United States,English,$410 million,150000000.0,410000000.0,November 30 2010,6.8,49,51%,The son of a virtual world designer goes looking for his father and ends up inside the digital world that his father designed. He meets his father's corrupted creation and a unique ally who was born inside the digital world.,"Action, Adventure, Sci-Fi","309,840",125.0,Joseph Kosinski,"['Sean Bailey', 'Jeffrey Silver', 'Steven Lisberger']",,"['Steven Lisberger', 'Bonnie MacBird']","['Garrett Hedlund', 'Jeff Bridges', 'Olivia Wilde', 'Bruce Boxleitner', 'James Frain', 'Beau Garrett', 'Michael Sheen']",Daft Punk,Walt Disney Studios Motion Pictures,$150 million,"['Edward Kitsis', 'Adam Horowitz', 'Brian Klugman', 'Lee Sternthal']",,Claudio Miranda,James Haygood,"['Edward Kitsis', 'Adam Horowitz']","['Walt Disney Pictures', 'Sean Bailey Productions']",,,,,
344,Anaganaga O Dheerudu,"['Disney World Cinema', 'A Bellyful of Dreams Entertainment', 'Arka Media Works', 'Walt Disney Pictures India']",['14 January 2011 (India)'],,India,Telugu,(US$5.4 million),3800000.0,5400000.0,January 14 2011,,,,,,,,Prakash Kovelamudi,"['Prakash Kovelamudi', 'Shobu Yarlagadda', 'Prasad Devineni']",Choudekar Haricharan Madnoor,,"['Siddharth', 'Shruti Haasan', 'Lakshmi Manchu', 'Baby Harshitha']","['Salim–Sulaiman', 'M. M. Keeravani', 'Koti', 'Mickey J Meyer', 'Ananth']",UTV Motion Pictures,(US$3.8 million),,,Soundarrajan,Sravan Katikaneni,,,,,,,
345,Lilly the Witch: The Journey to Mandolan,Walt Disney Pictures,['17 February 2011'],90 minutes,Germany,German,,,,February 17 2011,4.8,N/A,,"Lilli is traveling to India, to solve a mystery.","Comedy, Family, Fantasy, Mystery",197,90.0,Harald Sicheritz,,"['Bettine von Borries', 'Achim von Borries']",,"['Alina Freund', 'Tanay Chheda']",Ian Honeyman,Walt Disney Studios Motion Pictures,,,,Thomas Kienast,,,,,,,,
346,Mars Needs Moms,"['Walt Disney Pictures', 'ImageMovers Digital']","['March 11, 2011']",88 minutes,United States,English,$39.2 million,150000000.0,39200000.0,March 11 2011,5.4,49,37%,A young boy named Milo gains a deeper appreciation for his mom after Martians come to Earth to take her away.,"Animation, Action, Adventure, Family, Sci-Fi","20,779",88.0,Simon Wells,"['Robert Zemeckis', 'Jack Rapke', 'Steve Starkey', 'Steven Boyd']",,"['Mars Needs Moms!', 'by', 'Berkeley Breathed']","['Seth Green', 'Dan Fogler', 'Tom Everett Scott', 'Elisabeth Harnois', 'Mindy Sterling', 'Joan Cusack']",John Powell,"['Walt Disney Studios', 'Motion Pictures']",$150 million,,,Robert Presley,Wayne Wahrman,"['Simon Wells', 'Wendy Wells']",,,,,,
