,Unnamed: 0,title,Production company,Release date,Country,Language,Budget(float),Box office(float),imdb,metascore,rotten_tmatoes,plot,genre,user_ratings,Running time(int),Directed by,Produced by,Written by,Based on,Starring,Music by,Distributed by,Story by,Narrated by,Cinematography,Edited by,Screenplay by
112,112,Superdad,Walt Disney Productions,"['December 14, 1973']",United States,English,30000000.0,7000000.0,5.2,61.0,33%,"Charlie McCready is a worried father. His daughter, Wendy will be attending college in the fall, and he feels the crowd she's hanging out with has no ambition, especially her boyfriend, ...","Comedy, Family",596,96.0,Vincent McEveety,Bill Anderson,"['Joseph L. McEveety', 'Harlan Ware']",unknown,"['Bob Crane', 'Barbara Rush', 'Kurt Russell', 'Joe Flynn', 'Kathleen Cody']",Buddy Baker,Buena Vista Distribution,unknown,unknown,Andrew Jackson,Ray de Leuw,unknown
113,113,Herbie Rides Again,Walt Disney Productions,"['June 6, 1974']",United States,English,30000000.0,38229000.0,5.7,49.0,80%,The living Volkswagen Beetle helps an old lady protect her home from a corrupt developer.,"Comedy, Family, Fantasy, Romance","7,256",88.0,Robert Stevenson,Bill Walsh,unknown,"['Characters', 'by Gordon Buford']","['Helen Hayes', 'Ken Berry', 'Stefanie Powers', 'Keenan Wynn', 'John McIntire']",George Bruns,Buena Vista Distribution,Gordon Buford,unknown,Frank V. Phillips,Cotton Warburton,Bill Walsh
114,114,The Bears and I,Walt Disney Productions,"['July 31, 1974']",United States,English,30000000.0,4000000.0,6.2,61.0,29%,A man seeking peace and quiet finds himself father to three bears.,"Drama, Family",297,89.0,Bernard McEveety,Winston Hibler,unknown,"['The Bears and I', 'by Robert Franklin Leslie']","['Patrick Wayne', 'Chief Dan George', 'Andrew Duggan', 'Michael Ansara', 'Robert Pine']",Buddy Baker,Buena Vista Distribution,unknown,Jack Speirs,Ted D. Landon,G. Gregg McLaughlin,John Whedon
115,115,The Castaway Cowboy,Walt Disney Productions,"['August 1, 1974']",United States,English,30000000.0,42900000.0,5.9,61.0,32%,"A Texas cowboy is rescued at sea by a 12-year-old boy. While he waits to return home, he decides to help out his rescuer's family.","Comedy, Family, Western",421,91.0,Vincent McEveety,"['Ron Miller', 'Winston Hibler']",Don Tait,unknown,"['James Garner', 'Vera Miles', 'Eric Shea', 'Robert Culp']",Robert F. Brunner,Buena Vista Distribution,unknown,unknown,Andrew Jackson,Cotton Warburton,unknown
116,116,The Island at the Top of the World,Walt Disney Productions,"December 20, 1974 (with Winnie the Pooh and Tigger Too )",United States,"['English', 'Swedish', 'Norwegian', 'Danish', 'Icelandic']",8000000.0,10000000.0,6.3,61.0,43%,"In 1907, four explorers discover a lost colony of Vikings in the Arctic.","Adventure, Family, Fantasy, Sci-Fi","2,275",93.0,Robert Stevenson,Winston Hibler,"['Ian Cameron', '(novel)', 'John Whedon', '(screenplay)']",unknown,"['Donald Sinden', 'David Hartman', 'Jacques Marin', 'Mako', 'Agneta Eckemyr']",Maurice Jarre,Buena Vista Distribution,unknown,unknown,Frank V. Phillips,Robert Stafford,unknown
117,117,The Strongest Man in the World,Walt Disney Productions,"['February 6, 1975']",United States,English,30000000.0,6600000.0,6.1,63.0,39%,Dexter Riley and his friends accidently discover a new chemical mixed with a cereal seems to give anyone temporary superhuman strength,"Comedy, Family, Sci-Fi","2,669",92.0,Vincent McEveety,Bill Anderson,Joseph L. McEveety,unknown,"['Kurt Russell', 'Joe Flynn', 'Eve Arden', 'Cesar Romero', 'Phil Silvers']",Robert F. Brunner,Buena Vista Distribution,unknown,unknown,Andrew Jackson,Cotton Warburton,unknown
118,118,Escape to Witch Mountain,Walt Disney Productions,"['March 21, 1975 (U.S.)']",United States,English,30000000.0,20000000.0,6.4,60.0,76%,Two mysterious orphan children have extraordinary powers and are chased by a scheming millionaire. But where do these kids really call home?,"Adventure, Family, Fantasy, Mystery, Sci-Fi","9,085",97.0,John Hough,"['Ron Miller', 'Jerome Courtland']",unknown,"['Escape to Witch Mountain', 'by', 'Alexander H. Key']","['Eddie Albert', 'Ray Milland', 'Donald Pleasence', 'Kim Richards', 'Ike Eisenmann']",Johnny Mandel,Buena Vista Distribution,unknown,unknown,"Frank V. Phillips , ASC",Robert Stafford,Robert Malcolm Young
119,119,The Apple Dumpling Gang,Walt Disney Productions,"['July 24, 1975']",United States,English,30000000.0,36853000.0,6.5,59.0,56%,Three orphan children strike gold in 1878 California.,"Comedy, Family, Western","4,980",100.0,Norman Tokar,Bill Anderson,Don Tait,unknown,"['Bill Bixby', 'Susan Clark', 'Don Knotts', 'Tim Conway', 'David Wayne', 'Slim Pickens', 'Harry Morgan', 'John McGiver', ""Clay O'Brien"", 'Don Knight']","['Paul J. Smith', 'Buddy Baker', 'Joseph S. Dubin', '(orchestration)']",Buena Vista Distribution,unknown,unknown,Frank V. Phillips,Ray de Leuw,unknown
120,120,One of Our Dinosaurs is Missing,Walt Disney Productions,"['July 9, 1975']","['United Kingdom', 'United States']",English,30000000.0,5500000.0,6.0,61.0,68%,"A suspected Western spy steals a secret microfilm from China and hides it in the skeleton of a museum dinosaur, prompting a frantic search for it by various interested parties.","Family, Adventure, Comedy, Mystery, Thriller","1,577",100.0,Robert Stevenson,Bill Walsh,Bill Walsh,The Great Dinosaur Robbery by,"['Peter Ustinov', 'Helen Hayes', 'Clive Revill', 'Derek Nimmo']",Ron Goodwin,Buena Vista Distribution,unknown,unknown,Paul Beeson,Peter Boita,unknown
121,121,The Best of Walt Disney's True-Life Adventures,Walt Disney Productions,"['October 8, 1975']",United States,English,30000000.0,42900000.0,7.1,61.0,unknown,Animals of all kinds are filmed in different moments of habitat.,"Documentary, Family",116,89.0,James Algar,"['Ben Sharpsteen', 'James Algar']","['James Algar', 'Winston Hibler', 'Ted Sears']",unknown,unknown,"['Paul Smith', 'Oliver Wallace', 'Buddy Baker']",Buena Vista Distribution,unknown,Winston Hibler,"['Alfred G. Milotte', 'Elma Milotte', 'N. Paul Kenworthy', 'Robert H. Crandall', 'Hugh A. Wilmar', 'James R. Simon', 'Herb and Lois Crisler', 'Tom McHugh', 'Jack C. Couffer']","['Norman Palmer', 'Lloyd L. Richardson', 'Anthony Gerard', 'Gregg McLaughlin', 'Gordon Brenner']",unknown
122,122,Ride a Wild Pony,Walt Disney Productions,"December 25, 1975","['United States', 'Australia']",English,1000000.0,42900000.0,6.3,61.0,56%,"Scott, a poor farm boy, is given a wild pony from a wealthy ranch owner's herd to ride to and from school. Scott and his pony soon become an inseparable team, until one day the pony ...","Adventure, Family",155,91.0,Don Chaffey,Jerome Courtland,Rosemary Anne Sisson,"['A Sporting Proposition', '(novel)', 'by', 'James Aldridge']","['Robert Bettles', 'Eva Griffith', 'Michael Craig']",John Addison,"['Buena Vista Distribution', '(US)', 'British Empire Films', '(Australia)']",unknown,unknown,Jack Cardiff,Mike Campbell,unknown
123,123,"No Deposit, No Return",Walt Disney Productions,"['February 11, 1976 (Los Angeles)']",United States,English,30000000.0,42900000.0,6.5,61.0,68%,"After finding out that their mother is going to be working through another school holiday, two children are shipped to spend the holiday with their Grandfather. On their way to their ...","Comedy, Family","1,225",112.0,Norman Tokar,Ron Miller,"['Arthur Alsberg', 'Don Nelson']",unknown,"['David Niven', 'Darren McGavin', 'Don Knotts', 'Herschel Bernardi', 'Charles Martin Smith', 'Barbara Feldon', 'Kim Richards', 'Brad Savage']",Buddy Baker,Buena Vista Distribution,unknown,unknown,Frank V. Phillips,Cotton Warburton,unknown
124,124,Treasure of Matecumbe,Walt Disney Productions,"['July 1, 1976']",United States,English,30000000.0,42900000.0,6.2,61.0,44%,"In 1869 Kentucky, a young boy and his friends set out to find a treasure chest hidden by his late father in the Florida Everglades during the Civil War.","Adventure, Family, Western",512,115.0,Vincent McEveety,"['Bill Anderson', 'Ron Miller']",Don Tait,"['A Journey to Matecumbe', 'by', 'Robert Lewis Taylor']","['Johnny Doran', 'Billy Atmore', 'Robert Foxworth', 'Joan Hackett', 'Peter Ustinov', 'Vic Morrow']",Buddy Baker,Buena Vista Distribution,unknown,unknown,Frank V. Phillips,Cotton Warburton,unknown
125,125,Gus,Walt Disney Productions,"['July 7, 1976']",United States,English,30000000.0,21873000.0,5.9,52.0,59%,"The California Atoms are in last place with no hope of moving up. But by switching the mule from team mascot to team member, (He can kick 100 yard field goals!) they start winning, and move...","Comedy, Family, Sport","1,614",95.0,Vincent McEveety,Ron Miller,unknown,unknown,"['Don Knotts', 'Edward Asner', 'Gary Grimes', 'Tim Conway', 'Harold Gould', 'Ronnie Schell', 'Tom Bosley', 'Louise Williams', 'Dick Butkus']",Robert F. Brunner,Buena Vista Distribution,Ted Key,unknown,Frank Phillips,Robert Stafford,"['Arthur Alsberg', 'Don Nelson']"
126,126,The Shaggy D.A.,Walt Disney Productions,"['December 17, 1976']",United States,English,30000000.0,10500000.0,5.9,60.0,50%,A lawyer makes an interesting discovery that could affect his chances of getting elected to office.,"Comedy, Family, Fantasy","2,548",91.0,Robert Stevenson,Bill Anderson,Don Tait,The Hound of Florence by Felix Salten,"['Dean Jones', 'Suzanne Pleshette', 'Tim Conway', 'Keenan Wynn']","['Paul J. Smith', 'Buddy Baker']",Buena Vista Distribution,unknown,unknown,Frank V. Phillips,"['Bob Bring', 'Norman R. Palmer']",unknown
127,127,Freaky Friday,Walt Disney Productions,"['December 17, 1976']",United States,English,5000000.0,36000000.0,6.2,70.0,88%,"An overworked mother and her daughter do not get along. When they switch bodies, each is forced to adapt to the other's life for one freaky Friday.","Comedy, Family, Fantasy, Music, Romance","123,211",95.0,Gary Nelson,Ron Miller,unknown,"['Freaky Friday', 'by Mary Rodgers']","['Jodie Foster', 'Barbara Harris', 'John Astin']",Johnny Mandel,Buena Vista Distribution,unknown,unknown,Charles F. Wheeler,Cotton Warburton,Mary Rodgers
128,128,Escape from the Dark,Walt Disney Productions,"['May 26, 1976', '(UK)', 'March 11, 1977', '(US)']","['United Kingdom', 'United States']",English,30000000.0,42900000.0,6.6,61.0,unknown,unknown,unknown,unknown,104.0,Charles Jarrott,Ron Miller,Rosemary Anne Sisson,unknown,"['Alastair Sim', 'Peter Barkworth', 'Maurice Colbourne', 'Susan Tebbs', 'Andrew Harrison', 'Chloe Franks']",Ron Goodwin,Buena Vista Distribution,"['Burt Kennedy', 'Rosemary Anne Sisson']",unknown,Paul Beeson,Richard Marden,unknown
129,129,The Many Adventures of,Walt Disney Productions,"['March 11, 1977']",United States,English,30000000.0,42900000.0,7.6,61.0,100%,"In this collection of animated shorts based on the stories and characters by A.A. Milne, Winnie the Pooh, a honey-loving teddy bear, embarks on some eccentric adventures.","Animation, Adventure, Comedy, Family, Musical","31,962",74.0,"['John Lounsbery', 'Wolfgang Reitherman']",Wolfgang Reitherman,unknown,"['Winnie-the-Pooh', 'by', 'A. A. Milne']","['Sterling Holloway', 'John Fiedler', 'Junius Matthews', 'Paul Winchell', 'Howard Morris', 'Bruce Reitherman', 'Jon Walmsley', 'Timothy Turner']","['Richard M. Sherman', 'Robert B. Sherman', '(songs)', 'Buddy Baker', '(score)']",Buena Vista Distribution,"['Larry Clemmons', 'Ralph Wright', 'Vance Gerry', 'Xavier Atencio', 'Ken Anderson', 'Julius Svendsen', 'Ted Berman', 'Eric Cleworth']",Sebastian Cabot,unknown,"['Tom Acosta', 'James Melton']",unknown
130,130,A Tale of Two Critters,Walt Disney Productions,"['June 22, 1977']",United States,English,30000000.0,42900000.0,7.1,61.0,unknown,"A bear cub and a raccoon become fast friends when they're swept away down a river, away from their families.","Adventure, Family",59,48.0,Jack Speirs,Jack Speirs,unknown,unknown,unknown,Buddy Baker,Buena Vista Distribution,unknown,Mayf Nutter,unknown,G. Gregg McLaughlin,Jack Speirs
131,131,The Rescuers,Walt Disney Productions,"['June 22, 1977']",United States,English,7500000.0,169000000.0,6.9,74.0,81%,Two mice of the Rescue Aid Society search for a little girl kidnapped by unscrupulous treasure hunters.,"Animation, Adventure, Comedy, Family, Fantasy","56,999",77.0,"['Wolfgang Reitherman', 'John Lounsbery', 'Art Stevens']","['Wolfgang Reitherman', 'Ron W. Miller']",unknown,"['The Rescuers', 'and', 'Miss Bianca', 'by', 'Margery Sharp']","['Bob Newhart', 'Eva Gabor', 'Michelle Stacy', 'Geraldine Page', 'Joe Flynn', 'Jim Jordan', 'John McIntire', 'Jeanette Nolan', 'Pat Buttram', 'Bernard Fox']",Artie Butler,Buena Vista Distribution,"['Larry Clemmons', 'Vance Gerry', 'Ken Anderson', 'Frank Thomas', 'Burny Mattinson', 'Fred Lucky', 'Dick Sebast', 'David Michener', 'Ted Berman']",unknown,unknown,"['Jim Koford', 'James Melton']",unknown
132,132,Herbie Goes to Monte Carlo,Walt Disney Productions,"['June 24, 1977']",United States,English,30000000.0,29000000.0,5.7,38.0,60%,"Herbie, the Volkswagen Beetle with a mind of its own, is racing in the Monte Carlo Rally. Unbeknownst to Herbie's driver, thieves have hidden a cache of stolen diamonds in Herbie's gas tank, and are now trying to get them back.","Action, Adventure, Comedy, Crime, Family, Romance, Sport","6,687",104.0,Vincent McEveety,Ron Miller,"['Arthur Alsberg', 'Don Nelson']","['Characters', 'by Gordon Buford']","['Dean Jones', 'Don Knotts', 'Julie Sommars', 'Jacques Marin', 'Roy Kinnear', 'Bernard Fox', 'Eric Braeden', 'Xavier Saint-Macary', 'Johnny Haymer']",Frank De Vol,Buena Vista Distribution,unknown,unknown,Leonard J. South,Cotton Warburton,unknown
133,133,Pete's Dragon,Walt Disney Productions,"['November 3, 1977']",United States,English,10000000.0,36.0,6.7,71.0,88%,"The adventures of an orphaned boy named Pete and his best friend Elliott, who happens to be a dragon.","Action, Adventure, Comedy, Drama, Family, Fantasy","53,074",128.0,Don Chaffey,"['Jerome Courtland', 'Ron W. Miller']",unknown,unknown,"['Helen Reddy', 'Jim Dale', 'Mickey Rooney', 'Red Buttons', 'Jeff Conaway', 'Shelley Winters', 'Jane Kean', 'Jim Backus', 'Sean Marshall', 'Charlie Callas']",Irwin Kostal,Buena Vista Distribution,"['Seton I. Miller', 'S.S. Field']",unknown,Frank Phillips,Gordon D. Brenner,Malcolm Marmorstein
134,134,Candleshoe,Walt Disney Productions,"December 16, 1977",United States,English,30000000.0,42900000.0,6.8,68.0,71%,"Welcome to Candleshoe, a stately English manor where a swashbuckling pirate hid a fortune in Spanish doubloons centuries ago. And that's what young orphan Casey and a sly con man are determined to find.","Adventure, Comedy, Drama, Family","3,676",101.0,Norman Tokar,Ron Miller,"['David Swift', 'Rosemary Anne Sisson']",Christmas at Candleshoe novel by Michael Innes,"['Jodie Foster', 'David Niven', 'Helen Hayes', 'Leo McKern']",Ron Goodwin,Buena Vista Distribution,unknown,unknown,Paul Beeson,Peter Boita,unknown
135,135,Return from Witch Mountain,Walt Disney Productions,"['March 10, 1978']",United States,English,30000000.0,42900000.0,5.8,51.0,50%,"Tia and Tony visit Los Angeles, but he's quickly kidnapped by an evil scientist, leaving her to desperately search for him.","Family, Adventure, Sci-Fi, Fantasy","4,403",94.0,John Hough,"['Ron Miller', 'Jerome Courtland']",Malcolm Marmorstein,Characters created by Alexander Key,"['Bette Davis', 'Christopher Lee', 'Kim Richards', 'Ike Eisenmann', 'Jack Soo', 'Anthony James']",Lalo Schifrin,Buena Vista Distribution,unknown,unknown,Frank V. Phillips,Bob Bring,unknown
136,136,The Cat from Outer Space,Walt Disney Productions,"['June 30, 1978 (New York)']",United States,English,3500000.0,42900000.0,6.1,58.0,67%,"Three scientists help an Alien feline, stranded on Earth, to repair its damaged spacecraft in order to return home but their efforts are hampered by inept army officials and foreign spies.","Comedy, Family, Sci-Fi","4,397",104.0,Norman Tokar,Ron Miller,Ted Key,unknown,"['Ken Berry', 'Sandy Duncan', 'Harry Morgan', 'Ronnie Schell', 'Roddy McDowall', 'McLean Stevenson']",Lalo Schifrin,Buena Vista Distribution,unknown,unknown,Charles F. Wheeler,Cotton Warburton,unknown
137,137,Hot Lead and Cold Feet,Walt Disney Productions,"July 5, 1978",United States,English,30000000.0,42900000.0,6.2,61.0,65%,This saga of the old west involves twin brothers who compete for possession of a rickety cow town founded by their father while a crooked Mayor tries to put an end to the competitors so he can inherit the town himself.,"Action, Comedy, Family, Western","1,150",90.0,Robert Butler,Ron Miller,"['Joe McEveety', 'Arthur Alsberg', 'Don Nelson']",unknown,"['Jim Dale', 'Karen Valentine', 'Don Knotts', 'Jack Elam', 'Darren McGavin']",Buddy Baker,Buena Vista Distribution,Rod Piffath,unknown,Frank V. Phillips,Ray de Leuw,unknown
138,138,The North Avenue Irregulars,Walt Disney Productions,"February 9, 1979",United States,English,30000000.0,42900000.0,6.8,61.0,78%,"When crooks set up operations in a traditional town, a minister and a group of church ladies are willing to do anything, no matter how wacky, to get them out.","Action, Comedy, Crime, Family","1,038",100.0,Bruce Bilson,Ron Miller,Don Tait,unknown,"['Edward Herrmann', 'Barbara Harris', 'Susan Clark', 'Karen Valentine', 'Michael Constantine', 'Cloris Leachman', 'Steve Franken', 'Patsy Kelly', 'Douglas Fowley', 'Virginia Capers', 'Melora Hardin', 'Alan Hale, Jr.', 'Ruth Buzzi']","['Richard Bowden', 'Robert F. Brunner']",Buena Vista Distribution,unknown,unknown,Leonard J. South,Gordon D. Brenner,unknown
139,139,The Apple Dumpling Gang Rides Again,Walt Disney Productions,"['June 27, 1979']",United States,English,30000000.0,20931111.0,6.2,37.0,54%,"The adventures of two idiotic outlaw wannabees, Amos and Theodore.","Comedy, Family, Western","2,402",88.0,Vincent McEveety,"['Tom Leetch', 'Ron W. Miller']",Don Tait,unknown,"['Tim Conway', 'Don Knotts', 'Tim Matheson', 'Kenneth Mars', 'Jack Elam']","['Paul J. Smith', 'Buddy Baker', 'Joseph S. Dubin', '(orchestration)']",Buena Vista Distribution,unknown,unknown,Frank V. Phillips,Gordon Brenner,unknown
140,140,Unidentified Flying Oddball,Walt Disney Productions,"['July 19, 1979 (London)', 'August 3, 1979 (Los Angeles)']","['United Kingdom', 'United States']",English,5250000.0,42900000.0,5.3,66.0,33%,An astronaut and his android double travel back to the time of King Arthur.,"Comedy, Family, Adventure, Fantasy, Sci-Fi",917,93.0,Russ Mayberry,Ron Miller,Don Tait,A Connecticut Yankee in King Arthur's Court novel by Mark Twain,"['Dennis Dugan', 'Jim Dale', 'Ron Moody', 'Kenneth More', 'John Le Mesurier']",Ron Goodwin,Buena Vista Distribution,unknown,unknown,Paul Beeson,Peter Boita,unknown
141,141,The Black Hole,Walt Disney Productions,"['December 18, 1979 (United Kingdom)', 'December 21, 1979 (United States)']",United States,English,20000000.0,35800000.0,6.0,52.0,38%,"A research vessel finds a missing ship, commanded by a mysterious scientist, on the edge of a black hole.","Action, Sci-Fi","23,014",98.0,Gary Nelson,Ron Miller,unknown,unknown,"['Maximilian Schell', 'Anthony Perkins', 'Robert Forster', 'Joseph Bottoms', 'Yvette Mimieux', 'Ernest Borgnine', 'Roddy McDowall', 'Slim Pickens', 'Tom McLoughlin']",John Barry,Buena Vista Distribution,"['Jeb Rosebrook', 'Bob Barbash', 'Richard Landau']",unknown,Frank Phillips,Gregg McLaughlin,"['Gerry Day', 'Jeb Rosebrook']"
142,142,The Omega Connection,Walt Disney Productions,"December 21, 1979",United States,English,30000000.0,42900000.0,6.6,61.0,unknown,unknown,unknown,unknown,100.0,Robert Clouse,Jan Williams,"['Gail Morgan Hickman', 'David E. Boston']",unknown,"['Jeffrey Byron', 'Larry Cedar']",John Cameron,Buena Vista Distribution,unknown,unknown,Godfrey A. Godar,"['Peter Boita', 'Mike Campbell']",unknown
143,143,Midnight Madness,Walt Disney Productions,"['February 8, 1980']",United States,English,30000000.0,2900000.0,6.5,28.0,70%,"Leon planned ""the great all-nighter"" by picking college students to participate in an all-night long scavenger hunt. The 5 teams are given clues to solve, leading them to the next clue, ...",Comedy,"3,114",112.0,"['Michael Nankin', 'David Wechter']",Ron Miller,"['Michael Nankin', 'David Wechter']",unknown,"['David Naughton', 'Michael J. Fox', 'Stephen Furst', 'Maggie Roswell', 'Eddie Deezen', 'Dirk Blocker', 'Debra Clinger', 'Brad Wilkin']",Julius Wechter,Buena Vista Distribution,unknown,unknown,Frank V. Phillips,"['Norman R. Palmer', 'Jack Sekely']",unknown
144,144,The Watcher in the Woods,Walt Disney Productions,"['April 17, 1980 (New York City)', 'October 9, 1981 (U.S.)']",United States,English,9000000.0,5000000.0,6.3,61.0,50%,"When a family moves to a country home, the young girls experience strange happenings that have a link to an occult event years past.","Family, Horror, Mystery, Thriller","5,308",84.0,"['John Hough', 'Vincent McEveety (uncredited)']",Ron Miller,unknown,"['A Watcher in the Woods', 'by', 'Florence Engel Randall']","['Bette Davis', 'Carroll Baker', 'David McCallum', 'Lynn-Holly Johnson', 'Kyle Richards']",Stanley Myers,Buena Vista Distribution,unknown,unknown,Alan Hume,Geoffrey Foot,"['Brian Clemens', 'Harry Spalding', 'Rosemary Anne Sisson']"
145,145,Herbie Goes Bananas,Walt Disney Productions,"['June 27, 1980']",United States,English,30000000.0,18000000.0,5.0,55.0,40%,The adorable little VW helps its owners break up a counterfeiting ring in Mexico.,"Adventure, Comedy, Family, Fantasy","5,091",98.0,Vincent McEveety,"['Kevin Corcoran', 'Ron Miller', 'Don Tait']",Don Tait,"['Characters', 'by Gordon Buford']","['Cloris Leachman', 'Harvey Korman', 'Charles Martin Smith', 'Stephan W. Burns', 'John Vernon', 'Elyssa Davalos', 'Joaquin Garay III', 'Richard Jaeckel', 'Alex Rocco']",Frank De Vol,Buena Vista Distribution,unknown,unknown,Frank V. Phillips,Gordon D. Brenner,unknown
146,146,The Last Flight of Noah's Ark,Walt Disney Productions,"['July 9, 1980 (Los Angeles)']",United States,English,6000000.0,11000000.0,5.8,61.0,40%,"When a plane carrying various animals makes a forced landing on a desert island, the only chance to escape is to convert the plane into a boat.","Adventure, Family","1,221",97.0,Charles Jarrott,"['Ron Miller', 'Jan Williams']","['Steven W. Carabatsos', 'Sandy Glass', 'George Arthur Bloom']","['""The Gremlin\'s Castle""', 'by', 'Ernest K. Gann']","['Elliott Gould', 'Geneviève Bujold', 'Ricky Schroder']",Maurice Jarre,Buena Vista Distribution,unknown,unknown,Charles F. Wheeler,Gordon D. Brenner,unknown
147,147,Popeye,"['Paramount Pictures', 'Walt Disney Productions', 'Robert Evans Productions', 'King Features Entertainment']","['December 6, 1980']",United States,English,20000000.0,60000000.0,5.3,64.0,59%,The adventures of the famous sailor man and his friends in the seaside town of Sweethaven.,"Adventure, Comedy, Family, Fantasy, Musical, Romance","28,852",114.0,Robert Altman,Robert Evans,unknown,"['Popeye', 'by', 'E. C. Segar']","['Robin Williams', 'Shelley Duvall']",Harry Nilsson,"['Paramount Pictures (North America)', '(North America)', 'Buena Vista International Distribution (International)', '(International)']",unknown,unknown,Giuseppe Rotunno,"['John W. Holmes', 'David A. Simmons']",Jules Feiffer
148,148,The Devil and Max Devlin,Walt Disney Productions,"February 11, 1981 (Los Angeles)",United States,English,30000000.0,16000000.0,5.1,61.0,18%,"Max, a dead corrupt businessman, makes a Faustian pact with Satan's henchman to drive three people to Hell in exchange for longer life. Soon Max realizes that there still may be good in him.","Comedy, Family, Fantasy","1,122",96.0,Steven Hilliard Stern,Jerome Courtland,Mary Rodgers,unknown,"['Elliott Gould', 'Bill Cosby', 'Susan Anspach', 'Adam Rich', 'Julie Budd', 'Sonny Shroyer', 'David Knell', 'Chuck Shamata']","['Buddy Baker', 'Joseph S. Dubin', '(orchestration)']",Buena Vista Distribution,"['Mary Rodgers', 'Jimmy Sangster']",unknown,Howard Schwartz,Ray de Leuw,unknown
149,149,Amy,Walt Disney Productions,"March 20, 1981",United States,English,30000000.0,42900000.0,7.8,85.0,95%,Archival footage and personal testimonials present an intimate portrait of the life and career of British singer/songwriter Amy Winehouse.,"Documentary, Biography, Music","47,751",100.0,Vincent McEveety,Jerome Courtland,Noreen Stone,unknown,"['Jenny Agutter', 'Barry Newman', 'Kathleen Nolan', 'Chris Robinson', 'Lou Fant', ""Margaret O'Brien"", 'Nanette Fabray']",Robert F. Brunner,Buena Vista Distribution,unknown,unknown,Leonard J. South,Gregg McLaughlin,unknown
150,150,Dragonslayer,"['Paramount Pictures', 'Walt Disney Productions']","['June 26, 1981']",United States,English,18000000.0,14100000.0,6.7,68.0,84%,A young wizarding apprentice is sent to kill a dragon which has been devouring girls from a nearby kingdom.,"Action, Adventure, Fantasy","14,761",109.0,Matthew Robbins,"['Hal Barwood', 'Howard W. Koch']","['Hal Barwood', 'Matthew Robbins']",unknown,"['Peter MacNicol', 'Caitlin Clarke', 'Ralph Richardson', 'John Hallam', 'Peter Eyre', 'Sydney Bromley', 'Chloe Salaman', 'Ian McDiarmid']",Alex North,"['Paramount Pictures', 'Buena Vista International Distribution']",unknown,unknown,Derek Vanlint,Tony Lawson,unknown
